question_id,module_id,module_title,question,answer,content_type,difficulty,applicable_roles,applicable_levels,applicable_regions,applicable_industries,library_refs,threat_refs,timeline_refs,leader_refs,algorithm_refs,migrate_refs,compliance_refs,deep_links,consistency_assertions,source_citations
energy-utilities-pqc-learn-001,energy-utilities-pqc,Energy & Utilities PQC,Which NIST FIPS standards define the ML-KEM and ML-DSA algorithms used for post-quantum key encapsulation and digital signatures?,ML-KEM is defined in FIPS 203 as the standardized algorithm for quantum-resistant key encapsulation. ML-DSA is defined in FIPS 204 for protecting sensitive unclassified information in federal systems. These standards are critical for ensuring compliance in energy sector migrations.,learn,recall,architect;developer;compliance,beginner;intermediate,USA;Global,Energy & Utilities,FIPS 203;FIPS 204,,,,KEM,,NIST,/library?ref=FIPS%20203;/library?ref=FIPS%20204;/algorithms?highlight=KEM;/learn/energy-utilities-pqc,library_ref:FIPS 203 EXISTS|library_ref:FIPS 204 EXISTS|algorithm:KEM IN algorithms_csv|compliance_ref:NIST EXISTS,"Authoritative Source Context: FIPS 203, FIPS 204"
energy-utilities-pqc-learn-002,energy-utilities-pqc,Energy & Utilities PQC,What is the maximum end-to-end delivery time required for IEC 61850 GOOSE messages in Class P2/P3 protection applications?,"IEC 61850 GOOSE messages require an end-to-end delivery time of under 4 milliseconds for Class P2/P3 protection applications. Any cryptographic processing that exceeds this budget in the relay trip path can cause a breaker failure-to-trip, resulting in a safety-critical event.",learn,recall,engineer;ops;architect,intermediate,Global,Energy & Utilities,,,,,,,,/learn/energy-utilities-pqc,,Module Content: Safety-critical timing constraints
energy-utilities-pqc-learn-003,energy-utilities-pqc,Energy & Utilities PQC,Which NERC CIP standard specifically addresses the encryption of communications between control centers?,NERC CIP-012 addresses Communications Between Control Centers and is classified as critical urgency. It mandates the encryption of inter-control-center communications to protect grid operations from interception and manipulation.,learn,recall,compliance;executive;architect,intermediate,USA,Energy & Utilities,,,,,,,,/learn/energy-utilities-pqc,,Module Content: NERC-CIP compliance
energy-utilities-pqc-learn-004,energy-utilities-pqc,Energy & Utilities PQC,"Why is the 'Harvest Now, Decrypt Later' (HNDL) threat particularly acute for smart meters with 20+ year lifetimes?","Smart meters often have lifespans exceeding 20 years, meaning data encrypted today could be stored by attackers and decrypted in the future once cryptographically relevant quantum computers exist. This allows adversaries to reveal behavioral patterns and sensitive usage data from decades ago.",learn,comprehension,researcher;executive;architect,intermediate,Global,Energy & Utilities,,,,,,,,/learn/energy-utilities-pqc,,Module Content: Smart metering and AMI; Curious Summary
energy-utilities-pqc-learn-005,energy-utilities-pqc,Energy & Utilities PQC,How does the lack of native asymmetric crypto in IEC 62351-6 affect the security of GOOSE and Sampled Values protocols?,"IEC 62351-6 profiles for GOOSE and Sampled Values do not currently support native asymmetric cryptography, relying instead on multicast mechanisms. Consequently, PQC migration for these real-time protocols cannot be inserted directly into the data path but must rely on pre-shared symmetric MACs or offloaded security appliances.",learn,comprehension,architect;developer;ops,intermediate;advanced,Global,Energy & Utilities,,,,,,,,/learn/energy-utilities-pqc,,Module Content: OT protocols and crypto feasibility
energy-utilities-pqc-learn-006,energy-utilities-pqc,Energy & Utilities PQC,What is the primary cryptographic vulnerability in DNP3 Secure Authentication v5 that necessitates PQC migration?,"DNP3 Secure Authentication v5 uses HMAC-SHA256 for challenge-response, which is quantum-safe, but its asymmetric update key change ceremony relies on RSA-2048. This RSA component is vulnerable to quantum attacks and must be migrated to ML-DSA to secure the key distribution channel.",learn,comprehension,architect;developer;security,intermediate,Global,Energy & Utilities,,,,,RSA-2048,,,/algorithms?highlight=RSA-2048;/learn/energy-utilities-pqc,algorithm:RSA-2048 IN algorithms_csv,Module Content: OT protocols and crypto feasibility
energy-utilities-pqc-workshop-007,energy-utilities-pqc,Energy & Utilities PQC,"If a utility plans to migrate a transmission substation's TLS cipher suites, which PQC algorithm should be prioritized for key encapsulation according to the module?","For migrating TLS cipher suites in IEC 62351 Part 3 profiles, utilities should prioritize ML-KEM for key encapsulation. The module indicates that draft profiles for this migration are expected between 2026 and 2027.",workshop,application,architect;developer;ops,intermediate;advanced,Global,Energy & Utilities,,,,,KEM,,,/algorithms?highlight=KEM;/learn/energy-utilities-pqc,algorithm:KEM IN algorithms_csv,Module Content: IEC 62351 PQC migration status
energy-utilities-pqc-workshop-008,energy-utilities-pqc,Energy & Utilities PQC,A utility is managing a smart meter fleet using DLMS/COSEM. Which symmetric encryption algorithm should be retained for payload data to ensure Grover-safety?,"The utility should retain AES-256-GCM for symmetric data encryption in the DLMS/COSEM protocol. While key establishment must migrate to ML-KEM, AES-256 is considered safe against Grover's algorithm, unlike AES-128.",workshop,application,architect;developer;ops,intermediate,Global,Energy & Utilities,,,,,KEM,,,/algorithms?highlight=KEM;/learn/energy-utilities-pqc,algorithm:KEM IN algorithms_csv,Module Content: Smart metering and AMI
energy-utilities-pqc-workshop-009,energy-utilities-pqc,Energy & Utilities PQC,How should a grid operator handle algorithm changes in a Bulk Electric System (BCS) to remain compliant with NERC CIP?,Algorithm changes in the BCS must be documented in the Cyber Security Management System (CSMS) and approved by the grid operator. Unilateral algorithm changes without a documented CSMS update constitute a compliance violation under NERC CIP requirements.,workshop,application,compliance;executive;ops,intermediate;advanced,USA,Energy & Utilities,,,,,,,,/learn/energy-utilities-pqc,,Module Content: NERC-CIP compliance
energy-utilities-pqc-both-010,energy-utilities-pqc,Energy & Utilities PQC,Synthesize the impact of replacing classical ECDH keys with ML-KEM ciphertexts on a smart meter network using Power Line Communication (PLC).,"Replacing 33-byte classical ECDH keys with 1,088-byte ML-KEM ciphertexts creates a massive bandwidth bottleneck on slow PLC networks. This transformation turns routine background key rotations into multi-day network operations, requiring careful scheduling to avoid service disruption.",both,synthesis,architect;ops;executive,advanced,Global,Energy & Utilities,,,,,KEM,,,/algorithms?highlight=KEM;/learn/energy-utilities-pqc,algorithm:KEM IN algorithms_csv,Curious Summary: What's Happening
energy-utilities-pqc-both-011,energy-utilities-pqc,Energy & Utilities PQC,Compare the PQC migration strategy for a 500 kV transmission substation versus a 4 kV distribution substation based on IEC 62351 requirements.,"Transmission substations (500 kV+) require full IEC 62351 Parts 3, 5, and 6 compliance with direct NERC-CIP applicability, making them the highest priority for PQC migration. Distribution substations often rely on legacy SCADA with Modbus or DNP3 and may only have partial IEC 62351 applicability, allowing for a more phased approach.",both,synthesis,architect;executive;planner,advanced,Global,Energy & Utilities,,,,,,,NERC-CIP,/learn/energy-utilities-pqc,compliance_ref:NERC-CIP EXISTS,Module Content: Substation types and security tiers
energy-utilities-pqc-both-012,energy-utilities-pqc,Energy & Utilities PQC,Evaluate the risk of inserting PQC authentication directly into the real-time path of an IEC 61850 Sampled Values (SV) merging unit.,"Inserting PQC authentication directly into the SV path is unsafe because SV data requires microsecond-precision timestamps and high sample rates. Any additional crypto processing could violate timing constraints, leading to protection relay failures; therefore, authentication must use pre-shared symmetric MACs or be offloaded.",both,synthesis,architect;engineer;safety,advanced,Global,Energy & Utilities,,,,,,,,/learn/energy-utilities-pqc,,Module Content: Safety-critical timing constraints
energy-utilities-pqc-both-013,energy-utilities-pqc,Energy & Utilities PQC,How does the 40–50 year asset lifecycle of substations influence the urgency of PQC migration decisions made today?,"Substations have lifecycles of 40–50 years, meaning cryptographic decisions made today will lock in quantum exposure for decades. Since cryptographically relevant quantum computers are expected to arrive before these assets are retired, delaying migration leaves critical infrastructure vulnerable for the majority of its operational life.",both,synthesis,executive;architect;researcher,advanced,Global,Energy & Utilities,,,,,,,,/learn/energy-utilities-pqc,,Module Content: Overview; Equipment lifecycle and retrofit strategy
energy-utilities-pqc-workshop-014,energy-utilities-pqc,Energy & Utilities PQC,Design a compliance roadmap that addresses both NERC CIP-013 supply chain risks and the technical migration of DNP3 key ceremonies.,"The roadmap must include vendor PQC roadmap requirements under NERC CIP-013 to ensure supply chain readiness. Simultaneously, it must schedule the migration of DNP3 asymmetric update key ceremonies from RSA-2048 to ML-DSA, ensuring all changes are documented in the CSMS to satisfy CIP-010.",workshop,synthesis,executive;compliance;architect,advanced,USA,Energy & Utilities,,,,,RSA-2048,,,/algorithms?highlight=RSA-2048;/learn/energy-utilities-pqc,algorithm:RSA-2048 IN algorithms_csv,Module Content: NERC-CIP compliance; OT protocols and crypto feasibility
energy-utilities-pqc-workshop-015,energy-utilities-pqc,Energy & Utilities PQC,Analyze the trade-offs between using ML-KEM-512 versus ML-KEM-768 for a smart meter fleet with limited bandwidth and high security requirements.,"ML-KEM-768 offers higher security margins suitable for long-term asset lifecycles but generates larger ciphertexts (approx. 1,088 bytes) that strain low-bandwidth PLC networks. ML-KEM-512 reduces bandwidth pressure but may offer lower security assurance against future quantum capabilities, requiring a risk-based decision based on the specific threat model.",workshop,synthesis,architect;security;ops,advanced,Global,Energy & Utilities,,,,,ML-KEM-512;ML-KEM-768,,,/algorithms?highlight=ML-KEM-512;/algorithms?highlight=ML-KEM-768;/learn/energy-utilities-pqc,algorithm:ML-KEM-512 IN algorithms_csv|algorithm:ML-KEM-768 IN algorithms_csv,Module Content: Smart metering and AMI; energyConstants.ts
