reference_id,document_title,download_url,initial_publication_date,last_update_date,document_status,short_description,document_type,applicable_industries,authors_or_organization,dependencies,region_scope,AlgorithmFamily,SecurityLevels,ProtocolOrToolImpact,ToolchainSupport,MigrationUrgency,change_status,manual_category,downloadable,local_file,module_ids,misc_info
NSA-QKD-Advisory-2023,NSA Quantum Key Distribution and Quantum Cryptography,https://media.defense.gov/2023/Oct/24/2003324189/-1/-1/0/QUANTUM_KEY_DISTRIBUTION_QUANTUM_CRYPTOGRAPHY_20231024.PDF,2023-10-24,2023-10-24,Published,"NSA advisory explaining why it does not recommend QKD for national security systems. States that QKD addresses only the key distribution problem, requires special-purpose equipment, introduces trusted node vulnerabilities, and has side-channel risks in real implementations. Recommends PQC (CNSA 2.0 algorithms) as the primary solution. Key reference for balanced QKD vs PQC evaluation.",Guidance,Government;Defense;Finance,National Security Agency (NSA),,Global,QKD,All,QKD; Key Distribution,,High,,Government Guidance,no-forbidden,,qkd,
IETF RFC 4253,The Secure Shell (SSH) Transport Layer Protocol,https://www.rfc-editor.org/rfc/rfc4253.html,2006-01-01,2006-01-01,Standards Track RFC,"Defines the SSH transport layer including key exchange, server authentication, and encryption. The key exchange phase is where QKD-derived pre-shared keys can be injected via the ext-info mechanism or future SSH KEX extensions. Foundational standard for understanding QKD integration into SSH.",Protocol,All,IETF,,Global,SSH,All,SSH,,Medium,,PQC Protocol Specification,yes,public/library/IETF_RFC_4253.html,vpn-ssh-pqc;qkd,
IEEE-802-1AE-2018,IEEE 802.1AE-2018: MAC Security (MACsec),https://standards.ieee.org/ieee/802.1AE/6095/,2006-08-01,2018-12-01,IEEE Standard,"Defines MACsec — IEEE Layer 2 encryption standard for Ethernet networks. MACsec uses AES-GCM-128/256 for confidentiality and integrity. QKD-derived keys can be injected as Secure Association Keys (SAKs) via the MACsec Key Agreement (MKA) protocol, making MACsec a natural integration point for QKD in enterprise and telecom networks.",Protocol,Finance;Government;Telecom;Enterprise,IEEE 802.1 Working Group,,Global,AES-GCM; QKD integration,AES-128; AES-256,MACsec; Layer 2 encryption; QKD key injection,,Medium,,PQC Protocol Specification,yes,public/library/IEEE-802-1AE-2018.html,vpn-ssh-pqc;qkd,
draft-ietf-jose-pqc-kem,Use of Post-Quantum Key Encapsulation Mechanisms in JOSE,https://datatracker.ietf.org/doc/draft-ietf-jose-pqc-kem/,2024-01-01,2025-11-01,Internet-Draft,"Defines how to use ML-KEM (FIPS 203) within JOSE/JWE for quantum-safe token encryption. Introduces alg identifiers ML-KEM-512, ML-KEM-768, ML-KEM-1024 for JWE key agreement, replacing quantum-vulnerable ECDH-ES. Companion to draft-ietf-jose-pqc-algorithms for signature migration.",Standard (Draft),IT;Finance;Identity Management;APIs,IETF JOSE WG,FIPS 203;RFC 7516;RFC 7517;RFC 7518,Global,ML-KEM,L1;L3;L5,JOSE;JWE;JWK;COSE;Token Encryption,In development,High,New,Protocols,yes,public/library/draft-ietf-jose-pqc-kem.html,api-security-jwt,
draft-ietf-jose-pqc-algorithms,Use of Post-Quantum Algorithms in JOSE,https://datatracker.ietf.org/doc/draft-ietf-jose-pqc-algorithms/,2024-01-01,2026-01-01,Internet-Draft,"Defines how to use ML-DSA (FIPS 204) and SLH-DSA (FIPS 205) as digital signature algorithms in JOSE JWS. Specifies alg identifiers ML-DSA-44, ML-DSA-65, ML-DSA-87, SLH-DSA-SHA2-128s and others for signing JWTs. The critical standard enabling PQC JWT signing across all JOSE implementations.",Standard (Draft),IT;Finance;Identity Management;APIs,IETF JOSE WG,FIPS 204;FIPS 205;RFC 7515;RFC 7518,Global,ML-DSA;SLH-DSA,L1;L2;L3;L5,JOSE;JWS;JWT Signing;COSE,In development,High,New,Protocols,no-http-404,,api-security-jwt,
RFC 8725,JSON Web Token Best Current Practices,https://www.rfc-editor.org/rfc/rfc8725.html,2020-02-01,2020-02-01,Best Current Practice,"Documents security pitfalls and best practices for JWT usage including algorithm confusion attacks, none-algorithm vulnerabilities, audience validation, and expiry enforcement. Essential security hardening baseline before migrating JWT signing algorithms to PQC alternatives.",Guidance,IT;Finance;Identity Management;APIs,IETF,RFC 7515;RFC 7519,Global,,,JWT;JWS;OAuth 2.0;OIDC,All JOSE implementations,High,New,Protocols,yes,public/library/RFC_8725.html,api-security-jwt,
RFC 7519,JSON Web Token (JWT),https://www.rfc-editor.org/rfc/rfc7519.html,2015-05-01,2015-05-01,Proposed Standard,"Defines JWT as a compact URL-safe representation of claims between parties. Specifies the three-part structure (header.payload.signature), registered claim names (iss, sub, aud, exp, iat), and how JWS and JWE are used for signing and encryption. Foundation document for all JWT-based PQC migration work.",Standard,IT;Finance;Identity Management;APIs,IETF,RFC 7515;RFC 7516;RFC 7518,Global,,,JWT;OAuth 2.0;OIDC,Universal,High,New,Protocols,yes,public/library/RFC_7519.html,api-security-jwt,
RFC 7515,JSON Web Signature (JWS),https://www.rfc-editor.org/rfc/rfc7515.html,2015-05-01,2015-05-01,Proposed Standard,Defines the JWS standard for representing digitally signed content in JSON. Specifies the compact serialization (header.payload.signature) used in every signed JWT and the alg header parameter registry that PQC JOSE drafts extend with ML-DSA and SLH-DSA identifiers.,Standard,IT;Finance;Identity Management;APIs,IETF,RFC 7517;RFC 7518,Global,,,JWS;JWT;JOSE,Universal,High,New,Protocols,yes,public/library/RFC_7515.html,api-security-jwt,
RFC 7516,JSON Web Encryption (JWE),https://www.rfc-editor.org/rfc/rfc7516.html,2015-05-01,2015-05-01,Proposed Standard,"Defines the JWE standard for encrypting arbitrary content using JSON data structures. Specifies the 5-part compact serialization and key agreement mechanisms (ECDH-ES, RSA-OAEP) that ML-KEM replaces in PQC migration. Core reference for JWE encryption and PQC token confidentiality.",Standard,IT;Finance;Identity Management;APIs,IETF,RFC 7517;RFC 7518,Global,,,JWE;JWT;JOSE;Key Encapsulation,Universal,High,New,Protocols,yes,public/library/RFC_7516.html,api-security-jwt,
RFC 7517,JSON Web Key (JWK),https://www.rfc-editor.org/rfc/rfc7517.html,2015-05-01,2015-05-01,Proposed Standard,"Defines the JWK format for representing cryptographic keys as JSON. JWKS endpoints publish public keys for JWT signature verification. PQC migration significantly increases JWKS response sizes: ML-DSA-65 public keys are 1952 bytes vs 65 bytes for P-256, challenging HTTP header limits and caching strategies.",Standard,IT;Finance;Identity Management;APIs,IETF,RFC 7518,Global,,,JWK;JWKS;JWT Verification;Key Distribution,Universal,High,New,Protocols,yes,public/library/RFC_7517.html,api-security-jwt,
RFC 7518,JSON Web Algorithms (JWA),https://www.rfc-editor.org/rfc/rfc7518.html,2015-05-01,2015-05-01,Proposed Standard,"Defines the algorithm registry for JOSE including RS256, ES256, ECDH-ES, AES-GCM, and HMAC. All currently registered signature and key agreement algorithms are quantum-vulnerable to Shor's algorithm. PQC JOSE drafts extend this registry with ML-DSA and ML-KEM algorithm identifiers.",Standard,IT;Finance;Identity Management;APIs,IETF,,Global,,,JOSE Algorithm Registry;JWT;JWS;JWE,Universal,High,New,Protocols,yes,public/library/RFC_7518.html,api-security-jwt,
RFC 6749,The OAuth 2.0 Authorization Framework,https://www.rfc-editor.org/rfc/rfc6749.html,2012-10-01,2012-10-01,Proposed Standard,Defines the OAuth 2.0 authorization framework enabling secure delegated access using access tokens. Access tokens and ID tokens issued by authorization servers are typically JWTs signed with RSA or ECDSA. PQC migration requires updating JWT signing across all OAuth authorization servers and resource server token validation.,Standard,IT;Finance;Identity Management;APIs;Government,IETF,,Global,,,OAuth 2.0;JWT Access Tokens;API Authorization,Universal,High,New,Protocols,yes,public/library/RFC_6749.html,api-security-jwt,
RFC 9449,OAuth 2.0 Demonstrating Proof of Possession (DPoP),https://www.rfc-editor.org/rfc/rfc9449.html,2023-09-01,2023-09-01,Proposed Standard,Defines DPoP for binding OAuth 2.0 tokens to a client public key using signed proof-of-possession JWTs. DPoP proof JWTs use ECDSA signatures that are quantum-vulnerable. Migration to ML-DSA-signed DPoP proofs requires JOSE PQC standardization and results in significantly larger proof headers per request.,Standard,IT;Finance;Identity Management;APIs;Government,IETF,RFC 6749;RFC 7515;RFC 7517,Global,,,OAuth 2.0;DPoP;Token Binding;API Security,Major OAuth 2.0 server frameworks,Medium,New,Protocols,yes,public/library/RFC_9449.html,api-security-jwt,
NIST-SP-800-57-Pt1-R5,Recommendation for Key Management: Part 1 – General (Revision 5),https://nvlpubs.nist.gov/nistpubs/SpecialPublications/NIST.SP.800-57pt1r5.pdf,2020-05-04,2020-05-04,Final,"Primary NIST key management guideline covering key lifecycle (generation, distribution, storage, usage, rotation, archival, destruction), key types, cryptoperiods, FIPS 140 integration, and key compromise procedures. Foundation for all enterprise key management policy and HSM deployment.",Compliance/Guidance,Government; Finance; Healthcare; Defense; Enterprise IT,NIST,,USA; Global,All,N/A,Key management policy and HSM deployment,Reference guidance,High,New,General PQC Migration,yes,public/library/NIST-SP-800-57-Pt1-R5.pdf,kms-pqc;hsm-pqc,
KMIP-V2-1-OASIS,Key Management Interoperability Protocol (KMIP) Version 2.1,https://docs.oasis-open.org/kmip/kmip-spec/v2.1/os/kmip-spec-v2.1-os.html,2021-06-20,2021-06-20,OASIS Standard,"KMIP v2.1 defines a protocol for communication between key management systems and cryptographic clients. Supports key lifecycle operations (create, locate, get, activate, revoke, destroy) over TLS. Widely implemented by enterprise HSMs (Thales, Utimaco, Entrust) and KMS solutions. Enables interoperability between key management infrastructure during PQC migration.",Protocol,Government; Finance; Enterprise IT; HSM Vendors,OASIS KMIP Technical Committee,PKCS11-V3-OASIS,Global,Symmetric; Asymmetric; PQC (forthcoming),N/A,HSM and KMS key management interoperability,Thales Luna; Utimaco SecurityServer; Entrust nShield; HashiCorp Vault,High,New,Protocols,yes,public/library/KMIP-V2-1-OASIS.html,kms-pqc,
RFC 7228,Terminology for Constrained-Node Networks,https://www.rfc-editor.org/rfc/rfc7228.html,2014-05-01,2014-05-01,Informational,"Defines terminology and device classes (Class 0-2) for constrained-node IoT networks, including RAM/Flash constraints. Foundation for IoT PQC algorithm selection.",Protocol,IoT; Embedded Systems; Industrial,IETF,,International,,,IoT protocol design,IoT implementations,Low,New,General PQC Migration,yes,public/library/RFC_7228.html,iot-ot-pqc,
RFC 9019,A Firmware Update Architecture for Internet of Things (SUIT),https://www.rfc-editor.org/rfc/rfc9019.html,2021-04-01,2021-04-01,Informational,Defines the SUIT manifest format for secure firmware updates on constrained IoT devices. Specifies metadata fields used in PQC firmware signing workflows.,Protocol,IoT; Embedded Systems; Firmware,IETF SUIT,,International,Hash-based (stateful),L1-L5,Firmware update signing,Firmware implementations,Medium,New,General PQC Migration,yes,public/library/RFC_9019.html,iot-ot-pqc;stateful-signatures,
RFC 9147,The Datagram Transport Layer Security (DTLS) Protocol Version 1.3,https://www.rfc-editor.org/rfc/rfc9147.html,2022-04-01,2022-04-01,Proposed Standard,Specifies DTLS 1.3 — the UDP-based variant of TLS 1.3 used for CoAP and constrained IoT communications. Key reference for PQC handshake overhead analysis on constrained devices.,Protocol,IoT; Embedded Systems; Industrial,IETF TLS,,International,Lattice-based,L1-L5,DTLS/CoAP,wolfSSL; tinyDTLS; OpenSSL,High,New,PQC Protocol Specification,yes,public/library/RFC_9147.html,iot-ot-pqc;tls-basics,
RFC 8879,TLS Certificate Compression,https://www.rfc-editor.org/rfc/rfc8879.html,2020-11-01,2020-11-01,Proposed Standard,"Defines certificate compression for TLS 1.3, reducing PQC certificate chain overhead by ~30%. Key mitigation for certificate bloat on constrained IoT devices.",Protocol,IoT; Embedded Systems; PKI,IETF TLS,,International,Lattice-based,L1-L5,TLS/DTLS certificate handling,TLS implementations,Medium,New,PQC Protocol Specification,yes,public/library/RFC_8879.html,iot-ot-pqc;tls-basics;pki-workshop,
RFC 7250,Using Raw Public Keys in Transport Layer Security (TLS) and DTLS,https://www.rfc-editor.org/rfc/rfc7250.html,2014-06-01,2014-06-01,Proposed Standard,"Allows TLS/DTLS to use raw public keys instead of X.509 certificates, eliminating certificate chain overhead on ultra-constrained IoT devices. ~70% size reduction.",Protocol,IoT; Embedded Systems,IETF TLS,,International,,L1-L5,TLS/DTLS certificate handling,IoT TLS implementations,Medium,New,PQC Protocol Specification,yes,public/library/RFC_7250.html,iot-ot-pqc,
IEC 62443,IEC 62443: Industrial Automation and Control Systems Security,https://www.iec.ch/homepage,2010-01-01,2024-01-01,International Standard,"Multi-part standard series for OT/ICS/SCADA cybersecurity covering security levels, zones, conduits, and lifecycle requirements. Foundation for SCADA PQC migration planning.",Algorithm,Industrial; Critical Infrastructure; OT/ICS,IEC,,International,,,OT/ICS/SCADA security,OT security implementations,High,New,Government Guidance,no-forbidden,,iot-ot-pqc,
NIST SP 800-82 Rev. 3,Guide to Operational Technology (OT) Security,https://nvlpubs.nist.gov/nistpubs/SpecialPublications/NIST.SP.800-82r3.pdf,2023-09-01,2023-09-01,Final,"NIST guidance for securing industrial control systems (ICS), SCADA, DCS, and OT networks. Covers the Purdue model, network architecture, and security controls for critical infrastructure.",Algorithm,Industrial; Critical Infrastructure; Government,NIST,,US; International,,,OT/ICS/SCADA security,OT implementations,High,New,Government Guidance,yes,public/library/NIST_SP_800-82_Rev._3.pdf,iot-ot-pqc,
NSM-10,National Security Memorandum 10 — Promoting U.S. Leadership in Quantum Computing,https://bidenwhitehouse.archives.gov/briefing-room/statements-releases/2022/05/04/national-security-memorandum-on-promoting-united-states-leadership-in-quantum-computing-while-mitigating-risks-to-vulnerable-cryptographic-systems/,2022-05-04,2022-05-04,Final,US National Security Memorandum directing federal agencies to inventory cryptographic systems and transition to PQC. Established key milestones for quantum-resistant standards adoption.,Compliance/Policy,Government & Defense; Finance & Banking; Technology; Critical Infrastructure,White House,NIST IR 8545;NIST IR 8547,United States,N/A,N/A,Federal agency PQC migration,Federal systems,Critical,New,General PQC Migration,yes,public/library/NSM-10.html,compliance-strategy;migration-program;pqc-governance;pqc-risk-management,
OMB-M-23-02,OMB Memorandum M-23-02 — Migrating to Post-Quantum Cryptography,https://www.whitehouse.gov/wp-content/uploads/2022/11/M-23-02-M-Memo-on-Migrating-to-Post-Quantum-Cryptography.pdf,2022-11-18,2022-11-18,Final,OMB memo requiring federal agencies to submit cryptographic system inventories per NSM-10. Sets deadlines for PQC migration planning across US government systems.,Compliance/Policy,Government & Defense; Technology; Finance & Banking,OMB; White House,NIST IR 8545;NIST IR 8547;NSM-10,United States,N/A,N/A,US federal agency cryptographic inventory,Federal systems,Critical,New,General PQC Migration,yes,public/library/OMB-M-23-02.pdf,compliance-strategy;migration-program;pqc-governance;pqc-risk-management;data-asset-sensitivity,
QCCPA-2022,Quantum Computing Cybersecurity Preparedness Act (H.R.7535),https://www.congress.gov/bill/117th-congress/house-bill/7535,2022-12-21,2022-12-21,Enacted,US legislation requiring OMB to prioritize PQC migration across federal agencies. Established annual reporting requirements and directed NIST to maintain updated PQC guidance.,Regulation,Government & Defense,US Congress,NIST IR 8545;NIST IR 8547;NSM-10,United States,N/A,N/A,US federal PQC procurement and migration,Federal agencies,Critical,New,General PQC Migration,no-forbidden,,compliance-strategy;pqc-governance;pqc-business-case,
WH-PQC-Report-2024,White House Report on Post-Quantum Cryptography (July 2024),https://bidenwhitehouse.archives.gov/wp-content/uploads/2024/07/REF_PQC-Report_FINAL_Send.pdf,2024-07-01,2024-07-01,Final,"White House report estimating $7.1B government-wide PQC migration cost. Provides status of agency inventories, migration planning, and budget projections through 2035.",Guidance,Government & Defense; Finance & Banking; Technology,White House; ONCD,NIST IR 8545;NIST IR 8547;NSM-10;OMB-M-23-02,United States,N/A,N/A,US federal PQC migration budgeting and planning,Federal agencies,Critical,New,General PQC Migration,yes,public/library/WH-PQC-Report-2024.pdf,compliance-strategy;migration-program;pqc-governance;pqc-business-case;pqc-risk-management,
EO-14144,Executive Order 14144 — Strengthening and Promoting Innovation in the Nation's Cybersecurity,https://www.federalregister.gov/documents/2025/01/17/2025-01470/strengthening-and-promoting-innovation-in-the-nations-cybersecurity,2025-01-16,2025-01-16,Final,Biden administration executive order on cybersecurity including PQC provisions. Mandates PQC-ready systems for federal agencies and sets security standards for critical infrastructure.,Regulation,Government & Defense; Technology; Critical Infrastructure,White House,EO-14306;NIST IR 8545;NIST IR 8547;NSM-10,United States,N/A,N/A,US federal cybersecurity policy including PQC mandates,Federal systems,Critical,New,General PQC Migration,yes,public/library/EO-14144.html,compliance-strategy;pqc-governance;pqc-risk-management;migration-program,
BIS-Paper-158,BIS Paper 158 — Quantum-Readiness Roadmap for Financial Systems,https://www.bis.org/publ/bppdf/bispap158.htm,2025-01-01,2025-01-01,Published,"Bank for International Settlements paper outlining quantum-readiness roadmap for global financial systems. Covers cryptographic inventory, migration timelines, and cross-border interoperability for central banks.",Guidance,Finance & Banking; Government & Defense,BIS; Bank for International Settlements,FIPS 203;FIPS 204;NIST IR 8545;NIST IR 8547,Global,N/A,N/A,Financial sector PQC migration and interoperability,Central banks; financial institutions,High,New,General PQC Migration,yes,public/library/BIS-Paper-158.html,compliance-strategy;migration-program;pqc-risk-management;pqc-business-case,
EU-NIS-CG-Roadmap-v1.1,EU NIS Cooperation Group — Coordinated Implementation Roadmap for PQC Transition v1.1,https://digital-strategy.ec.europa.eu/en/library/coordinated-implementation-roadmap-transition-post-quantum-cryptography,2025-01-01,2025-01-01,Published,"EU NIS Cooperation Group coordinated roadmap v1.1 for PQC transition across EU member states. Provides harmonized timelines, priority sectors, and cross-border coordination mechanisms.",Compliance/Policy,Government & Defense; Technology; Finance & Banking; Critical Infrastructure,EU NIS Cooperation Group; European Commission; ENISA,ENISA PQC Guidelines;EU PQC Recommendation;FIPS 203;FIPS 204,European Union,N/A,N/A,EU-wide PQC migration coordination,EU member state governments and essential entities,High,New,General PQC Migration,yes,public/library/EU-NIS-CG-Roadmap-v1.1.html,compliance-strategy;migration-program;pqc-governance,
G7-CEG-Financial-PQC-2026,G7 Cyber Expert Group — Advancing a Coordinated Approach to PQC Transition for the Financial Sector,https://home.treasury.gov/,2026-01-01,2026-01-01,Published,"G7 Cyber Expert Group (chaired by US Treasury and Bank of England) releases cross-border PQC transition framework for global financial sector. Covers interoperability, shared timelines, and cryptographic agility.",Guidance,Finance & Banking; Government & Defense,G7 CEG; US Treasury; Bank of England,BIS-Paper-158;FIPS 203;FIPS 204;NIST IR 8545;NIST IR 8547,Global; G7,N/A,N/A,Global financial sector PQC migration coordination,G7 financial institutions and central banks,High,New,General PQC Migration,no-homepage,,compliance-strategy;migration-program;pqc-governance;pqc-business-case,
PKI-Consortium-PQC-2025,PKI Consortium PQC Conference 2025 — Conclusions and Call to Action,https://pkic.org/2025/11/04/post-quantum-cryptography-conference-2025-concludes-with-urgent-call-for-global-migration-to-quantum-resistant-encryption-systems/,2025-11-04,2025-11-04,Published,"World's largest PQC conference (2500+ delegates, 30+ countries) concluded in Kuala Lumpur. Issued urgent call for global migration. Includes Malaysia national PQC plan announcement.",Guidance,Government & Defense; Technology; Finance & Banking; Telecommunications,PKI Consortium,FIPS 203;FIPS 204;FIPS 205;NIST IR 8545;NIST IR 8547,Global,N/A,N/A,Global PQC adoption awareness and coordination,PKI professionals and organizations,High,New,General PQC Migration,yes,public/library/PKI-Consortium-PQC-2025.html,compliance-strategy;migration-program;pqc-governance;crypto-agility,
India-DST-NQM-Roadmap,India DST Task Force Report — Phased Roadmap for Migration to Post-Quantum Cryptography under NQM,https://dst.gov.in/sites/default/files/Report_TaskForce_PQMigration_4Feb26%20(v1).pdf,2026-02-04,2026-02-04,Published,"India DST Task Force under National Quantum Mission publishes phased roadmap for PQC migration. CII foundations by 2027, high-priority systems by 2028, full CII by 2029, nationwide by 2033.",Guidance,Government & Defense; Technology; Critical Infrastructure; Telecommunications; Finance & Banking,DST India; National Quantum Mission; CERT-In,FIPS 203;FIPS 204;FIPS 205;NIST IR 8545;NIST IR 8547,India; APAC,N/A,N/A,India national PQC migration across all sectors,Indian government and critical infrastructure operators,High,New,General PQC Migration,yes,public/library/India-DST-NQM-Roadmap.pdf,compliance-strategy;migration-program;pqc-governance;pqc-risk-management;quantum-threats,
India-TEC-910018-2025,India TEC Technical Report TEC 910018:2025 — Migration to Post-Quantum Cryptography,https://www.tec.gov.in/pdf/TR/Final%20technical%20report%20on%20migration%20to%20PQC%2028-03-25.pdf,2025-01-01,2025-01-01,Published,"Telecommunications Engineering Centre (India) technical report on migrating telecom infrastructure to PQC. Covers algorithm selection, protocol migration, and hybrid approaches for Indian telecom operators.",Guidance,Telecommunications; Government & Defense,TEC India; Department of Telecommunications,FIPS 203;FIPS 204;India-DST-NQM-Roadmap;NIST IR 8545;NIST IR 8547,India,N/A,N/A,Indian telecom PQC migration,Indian telecom operators,High,Updated,General PQC Migration,yes,public/library/India-TEC-910018-2025.pdf,compliance-strategy;migration-program;5g-security,
HKMA-Fintech-Blueprint-2026,HKMA Fintech Promotion Blueprint (From Adoption to Advancement) — Quantum Preparedness Index,https://www.hkma.gov.hk/eng/news-and-media/press-releases/2026/02/20260203-3/,2026-02-03,2026-02-03,Published,HKMA Fintech Promotion Blueprint launched February 2026. Includes Quantum Preparedness Index as flagship initiative for Hong Kong banking sector PQC readiness assessment and migration planning.,Guidance,Finance & Banking; Technology,HKMA; Hong Kong Monetary Authority,BIS-Paper-158;FIPS 203;FIPS 204;NIST IR 8545;NIST IR 8547,Hong Kong; APAC,N/A,N/A,Hong Kong financial sector PQC readiness assessment,Hong Kong banks and financial institutions,High,New,General PQC Migration,yes,public/library/HKMA-Fintech-Blueprint-2026.html,compliance-strategy;pqc-risk-management;pqc-business-case;migration-program,
Malaysia-NACSA-PQC-2025,Malaysia National PQC Migration Plan 2025-2030,https://www.nacsa.gov.my/,2025-11-01,2025-11-01,Published,Malaysia Ministry of Digital and NACSA publish first ASEAN national PQC migration plan (2025-2030). Includes proof-of-concept sandbox program for Malaysian government and critical infrastructure.,Compliance/Policy,Government & Defense; Technology; Critical Infrastructure; Telecommunications,NACSA Malaysia; Malaysia Ministry of Digital,FIPS 203;FIPS 204;NIST IR 8545;NIST IR 8547,Malaysia; ASEAN,N/A,N/A,Malaysia national PQC migration,Malaysian government agencies and CII operators,High,New,General PQC Migration,no-homepage,,compliance-strategy;migration-program;pqc-governance,
HK-CI-Ordinance-2025,Hong Kong Protection of Critical Infrastructure (Computer System) Ordinance,https://www.info.gov.hk/gia/general/202506/27/P2025062700238.htm,2025-06-27,2025-06-27,Enacted,Hong Kong Legislative Council enacts critical infrastructure cybersecurity legislation requiring operators to protect computer systems including cryptographic controls relevant to PQC migration.,Regulation,Government & Defense; Critical Infrastructure; Finance & Banking; Telecommunications; Energy & Utilities,Hong Kong LegCo; HKMA,NIST IR 8545;NIST IR 8547,Hong Kong,N/A,N/A,Hong Kong critical infrastructure cybersecurity compliance,Hong Kong critical infrastructure operators,High,New,General PQC Migration,yes,public/library/HK-CI-Ordinance-2025.html,compliance-strategy;pqc-governance;pqc-risk-management,
