patent_number,title,inventors,assignee,priority_date,issue_date,cpc_codes,one_sentence_summary,primary_inventive_claim,crypto_agility_mode,migration_strategy,quantum_relevance,quantum_notes,protocols,classical_algorithms,pqc_algorithms,quantum_technology,key_management_ops,hardware_components,authentication_factors,standards_referenced,threat_model,entropy_source,primitive_types,application_domain,independent_claim_subjects,performance_claims,data_types_protected,compliance_targets,citation_graph,claim_dependencies,nist_round_status
11947642,"Apparatuses, methods, and computer program products for proactive offline authentication",Bordow; Peter et al.,"Wells Fargo Bank, N.A.",2021-08-17,2024-04-02,G06F21/316,A system proactively generates offline authentication tokens by comparing current user attributes with prior credentials when a computing device loses network connectivity.,"The invention detects an impending offline condition of a computing device and compares current user attributes from a digital identity construct database against previously generated credentials. Upon detecting a discrepancy caused by the lack of connectivity, it generates an authentication token based on the prior credentials to enable offline access.",unclear,none,none,none,,,,none,generation; distribution,mobile; IoT,knowledge; inherence/biometric; location,ISO/IEC 24760-1:2011,,,,banking,computer-implemented method for proactive offline authentication; identity server for proactive offline authentication; computer program product for proactive offline authentication,,PII; biometric,,,"[{""claim"": 1, ""depends_on"": [], ""subject"": ""computer-implemented method for proactive offline authentication""}, {""claim"": 2, ""depends_on"": [1], ""subject"": ""detecting forthcoming request via user input""}, {""claim"": 3, ""depends_on"": [1], ""subject"": ""detecting forthcoming request via user parameters""}, {""claim"": 4, ""depends_on"": [1], ""subject"": ""transmitting authentication token""}, {""claim"": 5, ""depends_on"": [1], ""subject"": ""determining offline condition via transmission failure""}, {""claim"": 6, ""depends_on"": [1], ""subject"": ""causing access to an access location""}, {""claim"": 7, ""depends_on"": [1], ""subject"": ""determining offline condition based on count of failures""}, {""claim"": 8, ""depends_on"": [], ""subject"": ""identity server for proactive offline authentication""}, {""claim"": 9, ""depends_on"": [8], ""subject"": ""detecting forthcoming request via user input""}, {""claim"": 10, ""depends_on"": [8], ""subject"": ""detecting forthcoming request via user parameters""}, {""claim"": 11, ""depends_on"": [8], ""subject"": ""transmitting authentication token""}, {""claim"": 12, ""depends_on"": [8], ""subject"": ""determining offline condition via transmission failure""}, {""claim"": 13, ""depends_on"": [8], ""subject"": ""causing access to an access location""}, {""claim"": 14, ""depends_on"": [8], ""subject"": ""determining offline condition based on count of failures""}, {""claim"": 15, ""depends_on"": [], ""subject"": ""computer program product for proactive offline authentication""}, {""claim"": 16, ""depends_on"": [15], ""subject"": ""detecting forthcoming request via user input""}, {""claim"": 17, ""depends_on"": [15], ""subject"": ""detecting forthcoming request via user parameters""}, {""claim"": 18, ""depends_on"": [15], ""subject"": ""determining offline condition via transmission failure""}, {""claim"": 19, ""depends_on"": [15], ""subject"": ""causing access to an access location""}, {""claim"": 20, ""depends_on"": [15], ""subject"": ""transmitting authentication token""}]",[]
11930105,Extensible quantum random number generation,Stapleton; Jeff J. et al.,"Wells Fargo Bank, N.A.",2021-10-21,2024-03-12,H04L9/0877;H04L63/0869;H04L63/0435;H04L9/0852,A system distributes true quantum random numbers from a remote source to devices lacking local generation capability to secure communications via authentication and symmetric encryption.,The invention claims a method where an initiating device without true random number generation functionality obtains a quantum random number from a remote source over a secure channel. This number is then used by security circuitry to generate authentication data or symmetric keys for securing computer-implemented services with a participating device.,unclear,none,core_invention,"Quantum technology is central to the independent claims (1, 9, 14). Claim 1 requires obtaining a 'quantum random number' from a remote source. Claim 14 defines a service device with 'quantum random number generation hardware' using a 'quantum process'. The description also mentions an embodiment using entangled photons for authentication, but the primary claims focus on QRNG distribution.",,,,qrng; entanglement,generation; distribution; derivation,QRNG; quantum-source; mobile; IoT,possession,,MITM; unintended_party_interference,QRNG; quantum-entanglement,symmetric-cipher; MAC,banking,method for securing communications using quantum random numbers; initiating device with QRN management circuitry; quantum random number service device,,financial; sensitive_data,,,"[{""claim"": 1, ""depends_on"": [], ""subject"": ""method for securing communications using quantum random numbers""}, {""claim"": 2, ""depends_on"": [1], ""subject"": ""authentication operation and remediation actions""}, {""claim"": 3, ""depends_on"": [2], ""subject"": ""unilateral authentication details""}, {""claim"": 4, ""depends_on"": [2], ""subject"": ""mutual authentication""}, {""claim"": 5, ""depends_on"": [4], ""subject"": ""mutual authentication via remote security service""}, {""claim"": 6, ""depends_on"": [1], ""subject"": ""generating symmetric key and encrypting data""}, {""claim"": 7, ""depends_on"": [1], ""subject"": ""generating symmetric key and decrypting data""}, {""claim"": 8, ""depends_on"": [1], ""subject"": ""initiating device lacks true random number generation""}, {""claim"": 9, ""depends_on"": [], ""subject"": ""initiating device apparatus""}, {""claim"": 10, ""depends_on"": [9], ""subject"": ""authentication operation and remediation actions in device""}, {""claim"": 11, ""depends_on"": [10], ""subject"": ""unilateral authentication details in device""}, {""claim"": 12, ""depends_on"": [10], ""subject"": ""mutual authentication in device""}, {""claim"": 13, ""depends_on"": [10], ""subject"": ""device lacks true random number generation""}, {""claim"": 14, ""depends_on"": [], ""subject"": ""quantum random number service device""}, {""claim"": 15, ""depends_on"": [14], ""subject"": ""distributing information based on true random numbers""}, {""claim"": 16, ""depends_on"": [15], ""subject"": ""identical data distribution""}, {""claim"": 17, ""depends_on"": [14], ""subject"": ""exclusive source of true random numbers""}, {""claim"": 18, ""depends_on"": [14], ""subject"": ""distribution in response to request""}, {""claim"": 19, ""depends_on"": [14], ""subject"": ""distribution to authentication service""}]",[]
11645428,Quantum phenomenon-based obfuscation of memory,Meinholz; Michael Erik et al.,"Wells Fargo Bank, N.A.",2020-02-11,2023-05-09,G06N10/80;H04L9/0894;G06N10/00;G06F21/602;H04L9/0618;G06F21/79,A method for securing data by disassembling it into sections and storing them at memory locations determined by a quantum obfuscation map derived from quantum particle states.,"The invention discloses a method where data is disassembled into sections and stored in memory locations assigned via a Quantum Obfuscation Map (QOM). The QOM is generated based on Quantum Obfuscation Elements (QOEs) corresponding to the quantum state of a particle, such as a collapsed wave function or entangled pair.",hybrid,none,core_invention,"Quantum technology is central to the independent claims (1, 12, 20). The invention requires a Quantum Obfuscation Map (QOM) generated from Quantum Obfuscation Elements (QOEs) corresponding to a quantum state of a particle. Dependent claims specify QOEs as collapsed wave functions (claim 5) or derived from entangled particles (claim 11). The primary invention relies on these quantum states to determine memory addresses.",,RSA; Diffie-Hellman,,entanglement; qrng,generation; storage,HSM; QRNG; quantum-source,,,HNDL; quantum-attack,quantum-entanglement,symmetric-cipher,banking; financial,method for storing information using quantum phenomenon-based obfuscation; computing device comprising processing circuitry and cryptographic circuitry; computer program product for storing information using quantum phenomenon-based obfuscation,,financial; PII,,,"[{""claim"": 1, ""depends_on"": [], ""subject"": ""method for storing information using quantum phenomenon-based obfuscation""}, {""claim"": 2, ""depends_on"": [1], ""subject"": ""encrypting sections""}, {""claim"": 3, ""depends_on"": [2], ""subject"": ""encryption scheme based on data type""}, {""claim"": 4, ""depends_on"": [1], ""subject"": ""conditioning sections via data bus""}, {""claim"": 5, ""depends_on"": [1], ""subject"": ""QOE as collapsed wave function""}, {""claim"": 6, ""depends_on"": [1], ""subject"": ""separate storage of QOM and QOEs""}, {""claim"": 7, ""depends_on"": [1], ""subject"": ""storing fake sections in remainder memory""}, {""claim"": 8, ""depends_on"": [7], ""subject"": ""fake sections mimicking data type""}, {""claim"": 9, ""depends_on"": [1], ""subject"": ""re-assembling instance of information""}, {""claim"": 10, ""depends_on"": [1], ""subject"": ""memory as RAM or ROM""}, {""claim"": 11, ""depends_on"": [1], ""subject"": ""generating entangled quantum particles""}, {""claim"": 12, ""depends_on"": [], ""subject"": ""computing device for storing information using quantum phenomenon-based obfuscation""}, {""claim"": 13, ""depends_on"": [12], ""subject"": ""encrypting sections""}, {""claim"": 14, ""depends_on"": [13], ""subject"": ""encryption scheme based on data type""}, {""claim"": 15, ""depends_on"": [12], ""subject"": ""conditioning sections via data bus""}, {""claim"": 16, ""depends_on"": [12], ""subject"": ""QOE as collapsed wave function in cryptographic circuitry""}, {""claim"": 17, ""depends_on"": [12], ""subject"": ""storing fake sections in remainder memory""}, {""claim"": 18, ""depends_on"": [12], ""subject"": ""re-assembling instance of information""}, {""claim"": 19, ""depends_on"": [12], ""subject"": ""fake sections mimicking data type""}, {""claim"": 20, ""depends_on"": [], ""subject"": ""computer program product for storing information using quantum phenomenon-based obfuscation""}]",[]
11626983,Systems and methods for post-quantum cryptography optimization,"Carter, Jr.; Robert L. et al.","Wells Fargo Bank, N.A.",2019-09-10,2023-04-11,G06F16/2219;G06F16/252;H04L9/3093;G06F21/602;H04L9/0852,A system generates data attributes and envelopes to monitor data changes and dynamically apply post-quantum cryptographic techniques for migrating classical systems to quantum-resistant algorithms.,"The invention claims a system that generates data attributes and an enveloped data structure, then monitors the structure for changes. Upon detecting a change, the system performs actions including determining a specific post-quantum cryptographic technique and encrypting the data accordingly.",hybrid,crypto_agility,core_invention,"Quantum computing is central to the invention's purpose (PQC migration) and appears in independent claims 1, 18, and 20 as the target threat model driving the generation of PQC attributes and encryption. The system explicitly determines and applies 'PQC cryptographic techniques' in response to data changes.",TLS; SWIFT; ISO 8583; ISO 20022,RSA; Diffie-Hellman; DH; ECDH; ECDSA; DSA; AES,LMS; XMSS; SPHINCS+; Dilithium; qTESLA; NewHope; FrodoKEM; NTRU Prime; Kyber; SIKE; SIDH; Classic McEliece; QC-MDPC; BIKE; Rainbow; Picnic,quantum_computing,generation; exchange; storage,,,NIST Post-Quantum Cryptography Standardization Process,harvest now and decrypt later; quantum-attack; cryptanalysis,,symmetric-cipher; KEM; signature; hash,banking; financial services,system for post-quantum cryptography (PQC); method for post-quantum cryptography (PQC); computer program product for post-quantum cryptography (PQC),,financial; credit card number; mortgage information; tax information; personnel management data,FDIC Records Retention Schedule,,"[{""claim"": 1, ""depends_on"": [], ""subject"": ""system for post-quantum cryptography (PQC)""}, {""claim"": 2, ""depends_on"": [1], ""subject"": ""data comprises data access control information""}, {""claim"": 3, ""depends_on"": [1], ""subject"": ""data comprises a link to the data""}, {""claim"": 4, ""depends_on"": [3], ""subject"": ""link to a credit card number""}, {""claim"": 5, ""depends_on"": [1], ""subject"": ""data lineage data attribute""}, {""claim"": 6, ""depends_on"": [1], ""subject"": ""cryptographic data attribute from bitstream analysis""}, {""claim"": 7, ""depends_on"": [1], ""subject"": ""cryptographic spawn log""}, {""claim"": 8, ""depends_on"": [1], ""subject"": ""data zone data attribute""}, {""claim"": 9, ""depends_on"": [1], ""subject"": ""envelope comprises attributes""}, {""claim"": 10, ""depends_on"": [1], ""subject"": ""structure comprises envelope and data""}, {""claim"": 11, ""depends_on"": [1], ""subject"": ""structure comprises BLOB""}, {""claim"": 12, ""depends_on"": [1], ""subject"": ""regeneration upon access at second time""}, {""claim"": 13, ""depends_on"": [12], ""subject"": ""different data lineage attributes""}, {""claim"": 14, ""depends_on"": [1], ""subject"": ""regeneration upon zone transition""}, {""claim"": 15, ""depends_on"": [1], ""subject"": ""determining and applying PQC technique""}, {""claim"": 16, ""depends_on"": [1], ""subject"": ""machine learning for attributes""}, {""claim"": 17, ""depends_on"": [1], ""subject"": ""GUI generation""}, {""claim"": 18, ""depends_on"": [], ""subject"": ""method for post-quantum cryptography (PQC)""}, {""claim"": 19, ""depends_on"": [18], ""subject"": ""data comprises data access control information""}, {""claim"": 20, ""depends_on"": [], ""subject"": ""computer program product for post-quantum cryptography (PQC)""}]","[{""algorithm"": ""Kyber"", ""status"": ""fips_203""}, {""algorithm"": ""Dilithium"", ""status"": ""fips_204""}, {""algorithm"": ""SPHINCS+"", ""status"": ""fips_205""}, {""algorithm"": ""Classic McEliece"", ""status"": ""round4_candidate""}, {""algorithm"": ""BIKE"", ""status"": ""round4_candidate""}, {""algorithm"": ""FrodoKEM"", ""status"": ""withdrawn""}, {""algorithm"": ""SIKE"", ""status"": ""withdrawn""}, {""algorithm"": ""Rainbow"", ""status"": ""withdrawn""}, {""algorithm"": ""LMS"", ""status"": ""stateful_hash_standard""}, {""algorithm"": ""XMSS"", ""status"": ""stateful_hash_standard""}]"
11601266,Systems and methods for quantum consensus,Stapleton; Jeff J. et al.,"Wells Fargo Bank, N.A.",2020-02-11,2023-03-07,G06F21/72;H04L9/0852;H04L63/0435;H04B10/70;H04L63/0442;G06N10/00;H04L9/14;H04L9/32,Systems and methods for quantum entanglement authentication generate duplicate session keys at remote devices by measuring correlated subsets of entangled quantum particles to secure communications.,"The invention utilizes a set of entangled quantum particles distributed between two computing devices to generate identical or complimentary numbers based on measurements. These numbers are used to derive matching session keys, authenticating the session without transmitting the key over a classical channel.",hybrid,hybrid,core_invention,"Quantum entanglement is the core mechanism of the invention, appearing in independent claims 1, 19, and 20. The method requires receiving electronic identifications of subsets of entangled quantum particles and generating numbers based on measurements of these particles to authenticate sessions. It is not optional; the primary invention relies entirely on this quantum property.",TLS,RSA; AES; Diffie-Hellman; ECDSA; ECDH; SHA-256,,entanglement; qrng,generation; exchange; distribution,quantum-source; FPGA,possession,,MITM; cryptanalysis; quantum-attack; harvest_now_decrypt_later,quantum-entanglement,KEM; symmetric-cipher,banking; financial,method for Quantum Entanglement Authentication; system for quantum entanglement authentication; computer program product for quantum entanglement authentication,,session-keys; financial,,,"[{""claim"": 1, ""depends_on"": [], ""subject"": ""method for Quantum Entanglement Authentication""}, {""claim"": 2, ""depends_on"": [1], ""subject"": ""generation of third number based on measurement collapse""}, {""claim"": 3, ""depends_on"": [1], ""subject"": ""generation of first number causes generation of third number""}, {""claim"": 4, ""depends_on"": [1], ""subject"": ""generating and authenticating session keys""}, {""claim"": 5, ""depends_on"": [4], ""subject"": ""session key as mathematical product""}, {""claim"": 6, ""depends_on"": [1], ""subject"": ""transmitting measurement initiation control signal""}, {""claim"": 7, ""depends_on"": [1], ""subject"": ""generating cryptographic key and encrypting communication""}, {""claim"": 8, ""depends_on"": [7], ""subject"": ""symmetric cryptographic key""}, {""claim"": 9, ""depends_on"": [7], ""subject"": ""quantum asymmetric cryptographic key""}, {""claim"": 10, ""depends_on"": [7], ""subject"": ""measuring based on quantum bases""}, {""claim"": 11, ""depends_on"": [1], ""subject"": ""receiving time-dependent quantum measurement schedule""}, {""claim"": 12, ""depends_on"": [11], ""subject"": ""determining subset based on time-dependent schedule""}, {""claim"": 13, ""depends_on"": [1], ""subject"": ""receiving sequence-dependent quantum measurement schedule""}, {""claim"": 14, ""depends_on"": [13], ""subject"": ""determining subset based on sequence-dependent schedule""}, {""claim"": 15, ""depends_on"": [1], ""subject"": ""receiving third-party number from third computing device""}, {""claim"": 16, ""depends_on"": [15], ""subject"": ""generating updated session key with third-party number""}, {""claim"": 17, ""depends_on"": [16], ""subject"": ""updated session key as mathematical product""}, {""claim"": 18, ""depends_on"": [16], ""subject"": ""authenticating updated session key""}, {""claim"": 19, ""depends_on"": [], ""subject"": ""system for quantum entanglement authentication""}, {""claim"": 20, ""depends_on"": [], ""subject"": ""computer program product for quantum entanglement authentication""}]",[]
11477016,Systems and methods for post-quantum cryptography optimization,"Carter, Jr.; Robert L. et al.","Wells Fargo Bank, N.A.",2019-09-10,2022-10-18,G06F21/577;H04L9/3263;H04L9/3247;H04L9/14;H04L9/0852;G06F21/602;H04L9/088,A system optimizes post-quantum cryptography by selecting encryption attributes based on data risk profiles and performance metrics to double encrypt sensitive financial data.,"The invention provides a system that generates PQC encryption attributes by analyzing data attributes, risk profiles, and cryptographic performance information. It utilizes these attributes to perform double encryption of data, optimizing for security against quantum threats while managing computational resources.",negotiated,crypto_agility,core_invention,"Quantum computing is central to the invention, appearing in independent claims 1, 18, and 19 as the threat model driving the need for PQC optimization. The system specifically addresses vulnerabilities of classical algorithms (RSA, ECC) to quantum attacks (Shor's algorithm) and implements double encryption using PQC techniques.",TLS,RSA; AES; Diffie-Hellman; ECDSA; ECDH; DSA,LMS; XMSS; SPHINCS+; Dilithium; qTESLA; NewHope; FrodoKEM; NTRU Prime; Kyber; SIKE; SIDH; Classic McEliece; QC-MDPC; BIKE; Rainbow; Picnic,quantum_computing,generation; exchange; storage,,,NIST Post-Quantum Cryptography Standardization Process,HNDL; quantum-attack; cryptanalysis,,symmetric-cipher; KEM; signature; hash,banking; financial,system for post-quantum cryptography (PQC); method for post-quantum cryptography (PQC); computer program product for post-quantum cryptography (PQC),CPU utilization; memory utilization; encryption time; verification time; key length; payload size; payload longevity,financial; tax information; mortgages; auto loans; personnel management; judicial matters,FDIC Records Retention Schedule,,"[{""claim"": 1, ""depends_on"": [], ""subject"": ""system for post-quantum cryptography (PQC)""}, {""claim"": 2, ""depends_on"": [1], ""subject"": ""CPU utilization attribute""}, {""claim"": 3, ""depends_on"": [1], ""subject"": ""memory utilization attribute""}, {""claim"": 4, ""depends_on"": [1], ""subject"": ""encryption time attribute""}, {""claim"": 5, ""depends_on"": [1], ""subject"": ""verification time attribute""}, {""claim"": 6, ""depends_on"": [1], ""subject"": ""key length attribute""}, {""claim"": 7, ""depends_on"": [1], ""subject"": ""payload size attribute""}, {""claim"": 8, ""depends_on"": [1], ""subject"": ""payload longevity attribute""}, {""claim"": 9, ""depends_on"": [1], ""subject"": ""policy attributes""}, {""claim"": 10, ""depends_on"": [1], ""subject"": ""information classification attribute""}, {""claim"": 11, ""depends_on"": [1], ""subject"": ""mode of operation attribute""}, {""claim"": 12, ""depends_on"": [1], ""subject"": ""weighted scoring generation""}, {""claim"": 13, ""depends_on"": [12], ""subject"": ""maximum score selection""}, {""claim"": 14, ""depends_on"": [1], ""subject"": ""PQC algorithm variants""}, {""claim"": 15, ""depends_on"": [1], ""subject"": ""cryptographic spawn log""}, {""claim"": 16, ""depends_on"": [1], ""subject"": ""machine learning generation""}, {""claim"": 17, ""depends_on"": [1], ""subject"": ""PQC optimization GUI""}, {""claim"": 18, ""depends_on"": [], ""subject"": ""method for post-quantum cryptography (PQC)""}, {""claim"": 19, ""depends_on"": [], ""subject"": ""computer program product for post-quantum cryptography (PQC)""}, {""claim"": 20, ""depends_on"": [18], ""subject"": ""weighted scoring generation in method""}]","[{""algorithm"": ""Kyber"", ""status"": ""fips_203""}, {""algorithm"": ""Dilithium"", ""status"": ""fips_204""}, {""algorithm"": ""SPHINCS+"", ""status"": ""fips_205""}, {""algorithm"": ""Classic McEliece"", ""status"": ""round4_candidate""}, {""algorithm"": ""BIKE"", ""status"": ""round4_candidate""}, {""algorithm"": ""FrodoKEM"", ""status"": ""withdrawn""}, {""algorithm"": ""SIKE"", ""status"": ""withdrawn""}, {""algorithm"": ""Rainbow"", ""status"": ""withdrawn""}, {""algorithm"": ""Picnic"", ""status"": ""round4_candidate""}, {""algorithm"": ""LMS"", ""status"": ""stateful_hash_standard""}, {""algorithm"": ""XMSS"", ""status"": ""stateful_hash_standard""}]"
