patent_number,title,inventors,assignee,priority_date,issue_date,cpc_codes,one_sentence_summary,primary_inventive_claim,crypto_agility_mode,migration_strategy,quantum_relevance,quantum_notes,protocols,classical_algorithms,pqc_algorithms,quantum_technology,key_management_ops,hardware_components,authentication_factors,standards_referenced,threat_model,entropy_source,primitive_types,application_domain,independent_claim_subjects,performance_claims,data_types_protected,compliance_targets,citation_graph,claim_dependencies,nist_round_status
12231416,Systems and methods for multi-factor device authentication using quantum entangled particles,Stapleton; Jeff J.,"Wells Fargo Bank, N.A.",2022-12-06,2025-02-18,H04L63/08;H04L9/0852,"A multi-factor authentication system uses quantum entangled particles to generate shared bit sequences between devices, combined with an encrypted user password to verify identity and establish secure communication channels.",The invention claims a method where a requesting device generates a request data item using a quantum registry sequence derived from distributed quantum entangled particles. This quantum factor is combined with an encrypted user authentication factor to authenticate the device and user against a verifying device holding an identical copy of the quantum sequence.,negotiated,none,core_invention,Quantum entanglement is central to the independent claims (1 and 11). Claim 1 requires a 'quantum registry sequence obtained via a quantum distribution medium and with one or more quantum entangled particles'. The invention relies on both devices reading these particles to obtain identical bit sequences for authentication. It is not optional; the primary method cannot function without this quantum component.,,,,entanglement,generation; distribution; storage,quantum-source; mobile,knowledge; possession,,MITM; replay,quantum-entanglement,symmetric-cipher,banking,method for authentication between a requesting device and a verifying device; requesting device comprising communication hardware and transformation engine,,financial; PII,,,"[{""claim"": 1, ""depends_on"": [], ""subject"": ""method for authentication between a requesting device and a verifying device""}, {""claim"": 2, ""depends_on"": [1], ""subject"": ""obtaining quantum entangled particles and storing sequences in a registry""}, {""claim"": 3, ""depends_on"": [2], ""subject"": ""status of quantum registry sequences (unused, in-use, used)""}, {""claim"": 4, ""depends_on"": [1], ""subject"": ""selecting an unused quantum registry sequence""}, {""claim"": 5, ""depends_on"": [4], ""subject"": ""updating status to in-use after selection""}, {""claim"": 6, ""depends_on"": [5], ""subject"": ""modifying status to used after authentication acknowledgement""}, {""claim"": 7, ""depends_on"": [6], ""subject"": ""updating quantum registry with new sequences""}, {""claim"": 8, ""depends_on"": [1], ""subject"": ""encryption method agreement or identification""}, {""claim"": 9, ""depends_on"": [1], ""subject"": ""distributing encoded user authentication factor""}, {""claim"": 10, ""depends_on"": [1], ""subject"": ""establishing secure channel using second quantum registry sequence""}, {""claim"": 11, ""depends_on"": [], ""subject"": ""requesting device comprising communication hardware and transformation engine""}, {""claim"": 12, ""depends_on"": [11], ""subject"": ""obtaining particles and storing sequences in registry""}, {""claim"": 13, ""depends_on"": [12], ""subject"": ""status of quantum registry sequences""}, {""claim"": 14, ""depends_on"": [11], ""subject"": ""selecting unused quantum registry sequence""}, {""claim"": 15, ""depends_on"": [14], ""subject"": ""updating status to in-use""}, {""claim"": 16, ""depends_on"": [15], ""subject"": ""modifying status to used""}, {""claim"": 17, ""depends_on"": [16], ""subject"": ""updating quantum registry with new sequences""}, {""claim"": 18, ""depends_on"": [11], ""subject"": ""encryption method agreement or identification""}, {""claim"": 19, ""depends_on"": [11], ""subject"": ""distributing encoded user authentication factor""}, {""claim"": 20, ""depends_on"": [11], ""subject"": ""establishing secure channel using second quantum registry sequence""}]",[]
12231549,Systems and methods for device authentication using authentication tokens derived from quantum particles,Stapleton; Jeff J.,"Wells Fargo Bank, N.A.",2023-01-03,2025-02-18,H04L9/0852;H04L63/083;H04L63/0807;H04L9/3213,Systems and methods authenticate devices using authentication tokens derived from continuous streams of quantum particles distributed via a quantum medium to establish shared secrets without token exchange.,"The invention claims a method where an initiating device authenticates a participating device by comparing portions of authentication tokens derived from continuously obtained quantum particles. The tokens are bit strings associated with time intervals, allowing devices to share secrets without exchanging the tokens themselves over the communication network.",unclear,none,core_invention,"Quantum technology is central to the independent claims (1 and 11). Claim 1 explicitly requires using 'quantum particles obtained during the authentication process' via a 'quantum distribution medium' to update authentication tokens. The description specifies these are often quantum entangled particles distributed via QKD, though entanglement is noted as not strictly necessary in every embodiment, the use of quantum particles for token derivation is mandatory for the claimed invention.",QKD,,,qkd; entanglement,generation; distribution,quantum-source; IoT; mobile,possession,,MITM; replay,quantum-entanglement,MAC,banking,method for authentication between an initiating device and a participating device; initiating device comprising authentication circuitry,,financial,,,"[{""claim"": 1, ""depends_on"": [], ""subject"": ""method for authentication between an initiating device and a participating device""}, {""claim"": 2, ""depends_on"": [1], ""subject"": ""remediation action set upon unsuccessful authentication""}, {""claim"": 3, ""depends_on"": [1], ""subject"": ""authentication process with complementary token matching""}, {""claim"": 4, ""depends_on"": [1], ""subject"": ""authentication process with non-matching second token""}, {""claim"": 5, ""depends_on"": [1], ""subject"": ""authentication process using offset and first token""}, {""claim"": 6, ""depends_on"": [1], ""subject"": ""challenge-response authentication based on token portion""}, {""claim"": 7, ""depends_on"": [1], ""subject"": ""synchronization of authentication tokens""}, {""claim"": 8, ""depends_on"": [7], ""subject"": ""synchronization accounting for clock differences""}, {""claim"": 9, ""depends_on"": [8], ""subject"": ""exchanging token portions to identify indexing difference""}, {""claim"": 10, ""depends_on"": [1], ""subject"": ""tokens as bit strings associated with time intervals""}, {""claim"": 11, ""depends_on"": [], ""subject"": ""initiating device comprising authentication circuitry""}, {""claim"": 12, ""depends_on"": [11], ""subject"": ""remediation action set upon unsuccessful authentication""}, {""claim"": 13, ""depends_on"": [11], ""subject"": ""authentication process with complementary token matching""}, {""claim"": 14, ""depends_on"": [11], ""subject"": ""authentication process with non-matching second token""}, {""claim"": 15, ""depends_on"": [11], ""subject"": ""authentication process using offset and first token""}, {""claim"": 16, ""depends_on"": [11], ""subject"": ""challenge-response authentication based on token portion""}, {""claim"": 17, ""depends_on"": [11], ""subject"": ""synchronization of authentication tokens""}, {""claim"": 18, ""depends_on"": [17], ""subject"": ""synchronization accounting for clock differences""}, {""claim"": 19, ""depends_on"": [18], ""subject"": ""exchanging token portions to identify indexing difference""}, {""claim"": 20, ""depends_on"": [18], ""subject"": ""tokens as bit strings associated with time intervals""}]",[]
12231584,Relying party object identifiers schema (RPOIDS),Stapleton; Jeff J.,"Wells Fargo Bank, N.A.",2022-11-23,2025-02-18,H04L9/3263;H04L9/3268;H04L9/0825;H04L9/3247,A system embeds a relying party's Object Identifier into a subscriber's digital certificate extension to enforce application-specific authentication and authorization within a Public Key Infrastructure.,"The invention introduces a schema where a relying party sends its proprietary Object Identifier (OID) to a subscriber, which is then embedded as a critical or non-critical extension in the subscriber's X.509 certificate by a Certificate Authority. The relying party validates this OID within the received certificate before accepting the public key for secure communication.",unclear,none,none,none,PKI; X.509,,,none,generation; distribution,mobile; FPGA,possession,X.509; RFC 2986,,,signature; KEM,banking; PKI,method for relying party OID validation; method for subscriber certificate generation with OID; method for CA certificate issuance with OID,,,,,"[{""claim"": 1, ""depends_on"": [], ""subject"": ""method for relying party sending OID and validating certificate extension""}, {""claim"": 2, ""depends_on"": [1], ""subject"": ""determining OID presence in extension""}, {""claim"": 3, ""depends_on"": [1], ""subject"": ""OID corresponding to application usage""}, {""claim"": 4, ""depends_on"": [1], ""subject"": ""plurality of OIDs for multiple applications""}, {""claim"": 5, ""depends_on"": [4], ""subject"": ""validating specific OID from plurality""}, {""claim"": 6, ""depends_on"": [1], ""subject"": ""signing the OID with relying party private key""}, {""claim"": 7, ""depends_on"": [6], ""subject"": ""authenticating signed OID in certificate""}, {""claim"": 8, ""depends_on"": [1], ""subject"": ""establishing symmetric key using public key""}, {""claim"": 9, ""depends_on"": [1], ""subject"": ""OID identifying development stage""}, {""claim"": 10, ""depends_on"": [1], ""subject"": ""OID identifying application version""}, {""claim"": 11, ""depends_on"": [], ""subject"": ""method for subscriber receiving OID and requesting certificate""}, {""claim"": 12, ""depends_on"": [11], ""subject"": ""plurality of OIDs in subscriber request""}, {""claim"": 13, ""depends_on"": [], ""subject"": ""method for CA generating certificate with OID""}, {""claim"": 14, ""depends_on"": [13], ""subject"": ""generating TBS certificate and signing""}, {""claim"": 15, ""depends_on"": [13], ""subject"": ""OID corresponding to application, stage, or version""}]",[]
12200132,Secure multi-verification of biometric data in a distributed computing environment,Bell; Thomas E. et al.,"Wells Fargo Bank, N.A.",2022-08-25,2025-01-14,H04L9/3231;H04L9/3213,A method for secure multi-verification of biometric data in a distributed environment using authorization tokens and provenance data to verify user identity across multiple devices.,"The invention generates an authorization token based on initial biometric data from a first user and transmits it to a second user. Verification occurs by analyzing subsequent requests containing the token, new biometric data, and provenance data to confirm the source and timing of the data transfer.",unclear,none,none,"The patent text contains no references to quantum cryptography, QKD, QRNG, or post-quantum algorithms. The invention relies on classical biometric verification and token-based authorization.",,,,none,generation; distribution,mobile; FPGA; IoT,inherence/biometric; possession,,replay; insider,,,banking; cloud,method for secure multi-verification of biometric data; computing system for verifying data packages with biometric data,,biometric; PII,,,"[{""claim"": 1, ""depends_on"": [], ""subject"": ""method for secure multi-verification of biometric data""}, {""claim"": 2, ""depends_on"": [1], ""subject"": ""transmitting authorization or digital token""}, {""claim"": 3, ""depends_on"": [1], ""subject"": ""biometric data based on plurality of scans""}, {""claim"": 4, ""depends_on"": [3], ""subject"": ""scans of multiple different modalities""}, {""claim"": 5, ""depends_on"": [4], ""subject"": ""facial scan, fingerprint scan, and voice sample""}, {""claim"": 6, ""depends_on"": [1], ""subject"": ""provenance data identifying source and device""}, {""claim"": 7, ""depends_on"": [1], ""subject"": ""second provenance data including timing and errors""}, {""claim"": 8, ""depends_on"": [1], ""subject"": ""media files including audio, video, or images""}, {""claim"": 9, ""depends_on"": [8], ""subject"": ""audio or video file of user speaking phrase""}, {""claim"": 10, ""depends_on"": [9], ""subject"": ""analyzing audio/video to verify phrase based on script""}, {""claim"": 11, ""depends_on"": [9], ""subject"": ""verifying sounds based on voice signature""}, {""claim"": 12, ""depends_on"": [1], ""subject"": ""verifying biometric data against digital identity profile""}, {""claim"": 13, ""depends_on"": [12], ""subject"": ""digital identity profile maintained by computing system""}, {""claim"": 14, ""depends_on"": [12], ""subject"": ""digital identity profile maintained by second computing system""}, {""claim"": 15, ""depends_on"": [1], ""subject"": ""adding identification of request to digital identity profile""}, {""claim"": 16, ""depends_on"": [1], ""subject"": ""adding authorization token to digital identity profile""}, {""claim"": 17, ""depends_on"": [1], ""subject"": ""verifying first computing device based on digital identity profile""}, {""claim"": 18, ""depends_on"": [1], ""subject"": ""identifying second computing device based on digital identity profile""}, {""claim"": 19, ""depends_on"": [1], ""subject"": ""third computing device associated with third computing system""}, {""claim"": 20, ""depends_on"": [], ""subject"": ""computing system for secure multi-verification of biometric data""}]",[]
12200114,Systems and methods for mobile quantum key distribution,Stapleton; Jeff J.,"Wells Fargo Bank, N.A.",2021-10-21,2025-01-14,H04L9/0861;H04L9/0852;H04L9/0825,A mobile quantum key distribution system uses a portable device to generate entangled particles and inject them into remote devices or derive secure keys for legacy hardware to facilitate secure communication.,"The invention discloses a mobile quantum key distribution (MQKD) device that physically transports between locations to inject entangled particles directly into quantum-enabled devices. For non-quantum-enabled devices, the MQKD device measures the particles locally to generate and inject classical secure keys, enabling hybrid interoperability.",hybrid,none,core_invention,"Quantum technology is central to the independent claims (1, 9, 18). The invention requires generating a pair of entangled particles and injecting quantum data based on these particles. The primary method involves determining if devices are quantum-enabled; if so, entangled particles are transmitted directly. If not, the MQKD device measures the particles to generate classical keys. Thus, quantum generation is required for the core invention, though the transmission of raw quantum states is conditional on device capability.",,,,qkd; entanglement,generation; distribution; destruction,mobile; quantum-source; HSM,,,MITM,quantum-entanglement,KEM,banking,method for mobile quantum key distribution; mobile quantum key distribution device; mobile quantum key distribution device (means-plus-function),,session-keys,,,"[{""claim"": 1, ""depends_on"": [], ""subject"": ""method for mobile quantum key distribution""}, {""claim"": 2, ""depends_on"": [1], ""subject"": ""determining host device quantum capability""}, {""claim"": 3, ""depends_on"": [1], ""subject"": ""generating log file""}, {""claim"": 4, ""depends_on"": [1], ""subject"": ""key check value comparison""}, {""claim"": 5, ""depends_on"": [4], ""subject"": ""transmitting warning message""}, {""claim"": 6, ""depends_on"": [4], ""subject"": ""transmitting confirmation message""}, {""claim"": 7, ""depends_on"": [1], ""subject"": ""MQKD device embodied by drone""}, {""claim"": 8, ""depends_on"": [1], ""subject"": ""zeroizing quantum data""}, {""claim"": 9, ""depends_on"": [], ""subject"": ""mobile quantum key distribution device""}, {""claim"": 10, ""depends_on"": [9], ""subject"": ""determining host device quantum capability""}, {""claim"": 11, ""depends_on"": [9], ""subject"": ""generating log file""}, {""claim"": 12, ""depends_on"": [11], ""subject"": ""transmitting log file for validation""}, {""claim"": 13, ""depends_on"": [9], ""subject"": ""key check value comparison""}, {""claim"": 14, ""depends_on"": [13], ""subject"": ""transmitting warning message""}, {""claim"": 15, ""depends_on"": [13], ""subject"": ""transmitting confirmation message""}, {""claim"": 16, ""depends_on"": [9], ""subject"": ""MQKD device embodied by drone""}, {""claim"": 17, ""depends_on"": [9], ""subject"": ""zeroizing quantum data""}, {""claim"": 18, ""depends_on"": [], ""subject"": ""mobile quantum key distribution device (means-plus-function)""}]",[]
12200116,Systems and methods for measuring one or more metrics of a cryptographic algorithm in a post-quantum cryptography system,Rao; Abhijit Bhima et al.,"Wells Fargo Bank, N.A.",2022-11-18,2025-01-14,H04L9/0852,Systems and methods measure performance metrics of post-quantum and legacy cryptographic algorithms in hybrid systems using wrapped standardized interfaces within isolated private networks to facilitate migration decisions.,"The invention provides a method for benchmarking cryptographic algorithms by wrapping them to present a standardized interface to a sequence of operations. It observes metrics such as execution time, storage usage, and processor load within an isolated private network to generate comparative reports for algorithm selection.",hybrid,assessment,core_invention,"Quantum computing is central to the invention's purpose (measuring PQC algorithms). Independent claims 1 and 12 explicitly define the 'algorithm of interest' as a PQC algorithm or legacy algorithm in a hybrid PQC system. The background describes quantum threats (Shor's algorithm) motivating the benchmarking, but the claims focus on measuring classical implementations of PQC algorithms to prepare for quantum attacks.",TLS,RSA; DH; ECDH; AES; ECDSA; DSA,CRYSTALS-DILITHIUM; CRYSTALS-KYBER; SPHINCS+; NewHope; FrodoKEM; NTRU Prime; Classic McEliece; BIKE; Rainbow; Picnic; SIKE; SIDH,quantum_computing,generation; exchange,HSM; server; computing device; mobile,,NIST Post-Quantum Cryptography Standardization Process,quantum-attack; harvest now and decrypt later,,KEM; signature; symmetric-cipher,banking; financial services,method for measuring metrics of a cryptographic algorithm in a PQC system; apparatus for measuring metrics of a cryptographic algorithm in a PQC system,latency; storage-usage; processor-usage; benchmark-scores,financial; customer information,,,"[{""claim"": 1, ""depends_on"": [], ""subject"": ""method for measuring metrics of a cryptographic algorithm in a PQC system""}, {""claim"": 2, ""depends_on"": [1], ""subject"": ""operating parameters including payload descriptor and network address""}, {""claim"": 3, ""depends_on"": [1], ""subject"": ""sequence of benchmark operations including key generation and encryption""}, {""claim"": 4, ""depends_on"": [1], ""subject"": ""key establishment scheme operations""}, {""claim"": 5, ""depends_on"": [1], ""subject"": ""list of algorithms of interest""}, {""claim"": 6, ""depends_on"": [1], ""subject"": ""causing execution via driver circuitry""}, {""claim"": 7, ""depends_on"": [6], ""subject"": ""comparing multiple algorithms and outputting summary reports""}, {""claim"": 8, ""depends_on"": [6], ""subject"": ""execution on separate host device""}, {""claim"": 9, ""depends_on"": [6], ""subject"": ""accessing standardized interface via driver circuitry""}, {""claim"": 10, ""depends_on"": [1], ""subject"": ""computing benchmark scores""}, {""claim"": 11, ""depends_on"": [1], ""subject"": ""selecting algorithm for deployment based on benchmarks""}, {""claim"": 12, ""depends_on"": [], ""subject"": ""apparatus for measuring metrics of a cryptographic algorithm in a PQC system""}, {""claim"": 13, ""depends_on"": [12], ""subject"": ""operating parameters including payload descriptor and network address""}, {""claim"": 14, ""depends_on"": [12], ""subject"": ""sequence of benchmark operations including key generation and encryption""}, {""claim"": 15, ""depends_on"": [12], ""subject"": ""list of algorithms of interest""}, {""claim"": 16, ""depends_on"": [12], ""subject"": ""driver circuitry for causing execution""}, {""claim"": 17, ""depends_on"": [16], ""subject"": ""comparing multiple algorithms and outputting summary reports""}, {""claim"": 18, ""depends_on"": [16], ""subject"": ""execution on separate host device""}, {""claim"": 19, ""depends_on"": [16], ""subject"": ""accessing standardized interface via driver circuitry""}, {""claim"": 20, ""depends_on"": [12], ""subject"": ""computing benchmark scores""}]","[{""algorithm"": ""CRYSTALS-DILITHIUM"", ""status"": ""fips_204""}, {""algorithm"": ""CRYSTALS-KYBER"", ""status"": ""fips_203""}, {""algorithm"": ""SPHINCS+"", ""status"": ""fips_205""}, {""algorithm"": ""Classic McEliece"", ""status"": ""round4_candidate""}, {""algorithm"": ""BIKE"", ""status"": ""round4_candidate""}, {""algorithm"": ""FrodoKEM"", ""status"": ""withdrawn""}, {""algorithm"": ""Rainbow"", ""status"": ""withdrawn""}, {""algorithm"": ""Picnic"", ""status"": ""withdrawn""}, {""algorithm"": ""SIKE"", ""status"": ""withdrawn""}, {""algorithm"": ""SIDH"", ""status"": ""withdrawn""}]"
12192328,Systems and methods for secure communication based on random key derivation,Stapleton; Jeff J.,"Wells Fargo Bank, N.A.",2022-05-10,2025-01-07,H04L9/0825;H04L9/3242;H04L9/0891;H04L9/0869;H04L9/12;H04L9/0852,Systems and methods derive symmetric keys from a shared initial key and received seed bits to facilitate secure communication without repeated key distribution.,The invention derives new symmetric keys by combining a static initial key with dynamically received seed bits using a Key Derivation Function. This allows continuous key rotation for secure communication without the overhead of re-distributing the initial key or performing complex key establishment protocols.,unclear,none,dependent_claim_only,"Quantum Key Distribution (QKD) is mentioned in dependent claims 7 and 18 as an optional method to establish the initial key. Quantum Random Number Generators (QRNG) are mentioned in dependent claims 10 and 21 as an optional source for seed bits. The primary invention (independent claims 1, 12, 23) relies on random key derivation and does not require quantum technology.",TLS,,,qkd; qrng,derivation; distribution; storage; rotation,HSM; QRNG; IoT; mobile,,,eavesdropping,QRNG,symmetric-cipher; MAC; KDF,banking,method for secure communication based on random key derivation; apparatus for secure communication based on random key derivation; computer program product for secure communication based on random key derivation,bandwidth,,,,"[{""claim"": 1, ""depends_on"": [], ""subject"": ""method for secure communication based on random key derivation""}, {""claim"": 2, ""depends_on"": [1], ""subject"": ""symmetric key update process upon triggering condition""}, {""claim"": 3, ""depends_on"": [2], ""subject"": ""triggering condition definitions""}, {""claim"": 4, ""depends_on"": [2], ""subject"": ""use of first KDF""}, {""claim"": 5, ""depends_on"": [4], ""subject"": ""use of second different KDF""}, {""claim"": 6, ""depends_on"": [1], ""subject"": ""cryptographic data protection actions""}, {""claim"": 7, ""depends_on"": [1], ""subject"": ""initial key via QKD""}, {""claim"": 8, ""depends_on"": [1], ""subject"": ""initial key from key distribution device""}, {""claim"": 9, ""depends_on"": [1], ""subject"": ""seed bits as random number""}, {""claim"": 10, ""depends_on"": [9], ""subject"": ""QRNG for seed bits""}, {""claim"": 11, ""depends_on"": [1], ""subject"": ""pre-deriving and storing future keys""}, {""claim"": 12, ""depends_on"": [], ""subject"": ""apparatus for secure communication based on random key derivation""}, {""claim"": 13, ""depends_on"": [12], ""subject"": ""apparatus symmetric key update process""}, {""claim"": 14, ""depends_on"": [13], ""subject"": ""apparatus triggering condition definitions""}, {""claim"": 15, ""depends_on"": [13], ""subject"": ""apparatus use of first KDF""}, {""claim"": 16, ""depends_on"": [15], ""subject"": ""apparatus use of second different KDF""}, {""claim"": 17, ""depends_on"": [12], ""subject"": ""apparatus cryptographic data protection actions""}, {""claim"": 18, ""depends_on"": [12], ""subject"": ""apparatus initial key via QKD""}, {""claim"": 19, ""depends_on"": [12], ""subject"": ""apparatus initial key from key loading device""}, {""claim"": 20, ""depends_on"": [12], ""subject"": ""apparatus seed bits as random number""}, {""claim"": 21, ""depends_on"": [20], ""subject"": ""apparatus QRNG for seed bits""}, {""claim"": 22, ""depends_on"": [12], ""subject"": ""apparatus pre-deriving and storing future keys""}, {""claim"": 23, ""depends_on"": [], ""subject"": ""computer program product for secure communication based on random key derivation""}]",[]
