patent_number,title,inventors,assignee,priority_date,issue_date,cpc_codes,one_sentence_summary,primary_inventive_claim,crypto_agility_mode,migration_strategy,quantum_relevance,quantum_notes,protocols,classical_algorithms,pqc_algorithms,quantum_technology,key_management_ops,hardware_components,authentication_factors,standards_referenced,threat_model,entropy_source,primitive_types,application_domain,independent_claim_subjects,performance_claims,data_types_protected,compliance_targets,citation_graph,claim_dependencies,nist_round_status
11431510,Code-sign white listing (CSWL),Stapleton; Jeff J.,"Wells Fargo Bank, N.A.",2020-04-30,2022-08-30,H04L9/3268;H04L9/3247;H04L9/3242;H04L9/3265,A system manages code-sign white listing by generating a centralized list of certificates for multiple signed code segments to enable efficient client-side verification of authorization.,"The invention provides a method where a server generates a single list of certificates associated with a code bundle containing multiple signed segments from different developers. This list is transmitted to a client device, which uses it to verify the authorization of each distinct code segment without individually walking multiple certificate chains.",hybrid,none,none,"The patent mentions 'post quantum cryptography (PQC) signature' in the description as an optional type of digital signature that a developer may use. However, no independent or dependent claims specifically require PQC algorithms, and the primary invention functions entirely with classical cryptographic primitives.",PKI; X.509,RSA; SHA-2; SHA-3; HMAC; ECDSA; MAC,,none,distribution; storage,mobile; IoT,possession,,replay,,signature; hash; MAC,banking; blockchain; PKI,method for managing code-sign white listing; system for managing code-sign white listing; non-transitory computer-readable storage medium; client device method for verifying code bundle,,transactions,,,"[{""claim"": 1, ""depends_on"": [], ""subject"": ""method for managing code-sign white listing""}, {""claim"": 2, ""depends_on"": [1], ""subject"": ""determining code bundle association""}, {""claim"": 3, ""depends_on"": [1], ""subject"": ""extracting certificates from list""}, {""claim"": 4, ""depends_on"": [3], ""subject"": ""verifying signed segments using extracted certificates""}, {""claim"": 5, ""depends_on"": [1], ""subject"": ""extracting certificate chain including code-sign, issuer CA, and root CA""}, {""claim"": 6, ""depends_on"": [5], ""subject"": ""validating certificate chain structure""}, {""claim"": 7, ""depends_on"": [1], ""subject"": ""fetching certificates via URLs""}, {""claim"": 8, ""depends_on"": [1], ""subject"": ""digitally signing the list of certificates""}, {""claim"": 9, ""depends_on"": [8], ""subject"": ""attaching digital signature to list""}, {""claim"": 10, ""depends_on"": [8], ""subject"": ""digital signature separate from signed list""}, {""claim"": 11, ""depends_on"": [1], ""subject"": ""generating signature based on MAC/HMAC with TST""}, {""claim"": 12, ""depends_on"": [8], ""subject"": ""extracting public key to verify authentication of signed list""}, {""claim"": 13, ""depends_on"": [8], ""subject"": ""verifying digital signature""}, {""claim"": 14, ""depends_on"": [7], ""subject"": ""receiving and transmitting digital certificate from CA""}, {""claim"": 15, ""depends_on"": [1], ""subject"": ""receiving identifiers and updating database""}, {""claim"": 16, ""depends_on"": [1], ""subject"": ""code bundle executing on DLT network""}, {""claim"": 17, ""depends_on"": [], ""subject"": ""system for managing code-sign white listing""}, {""claim"": 18, ""depends_on"": [17], ""subject"": ""determining code bundle association""}, {""claim"": 19, ""depends_on"": [17], ""subject"": ""extracting certificates from list""}, {""claim"": 20, ""depends_on"": [19], ""subject"": ""verifying signed segments using extracted certificates""}, {""claim"": 21, ""depends_on"": [17], ""subject"": ""extracting certificate chain including code-sign, issuer CA, and root CA""}, {""claim"": 22, ""depends_on"": [21], ""subject"": ""validating certificate chain structure""}, {""claim"": 23, ""depends_on"": [17], ""subject"": ""fetching certificates via URLs""}, {""claim"": 24, ""depends_on"": [17], ""subject"": ""digitally signing the list of certificates""}, {""claim"": 25, ""depends_on"": [24], ""subject"": ""attaching digital signature to list""}, {""claim"": 26, ""depends_on"": [24], ""subject"": ""digital signature separate from signed list""}, {""claim"": 27, ""depends_on"": [17], ""subject"": ""generating signature based on MAC/HMAC with TST""}, {""claim"": 28, ""depends_on"": [24], ""subject"": ""extracting public key to verify authentication of signed list""}, {""claim"": 29, ""depends_on"": [24], ""subject"": ""verifying digital signature""}, {""claim"": 30, ""depends_on"": [17], ""subject"": ""receiving identifiers and updating database""}, {""claim"": 31, ""depends_on"": [17], ""subject"": ""code bundle executing on DLT network""}, {""claim"": 32, ""depends_on"": [], ""subject"": ""non-transitory computer-readable storage medium""}, {""claim"": 33, ""depends_on"": [], ""subject"": ""client device method for verifying code bundle""}]",[]
11356247,Systems and methods for quantum one-time pad generation,"Carter, Jr.; Robert L. et al.","Wells Fargo Bank, N.A.",2019-11-26,2022-06-07,H04L9/0656;G06F21/72;G06N10/40;H04L9/0825;G06N10/00;H04L9/0852,Systems and methods generate quantum one-time pads using entangled particles stored in separate devices to derive identical random numbers for session authentication and key generation without transmitting the keys.,"The invention generates a first quantum one-time pad comprising a set of entangled quantum particles and stores them in quantum storage cells. Each particle is entangled with a respective particle in a second quantum one-time pad stored at a remote device, enabling the generation of identical random numbers upon measurement.",hybrid,hybrid,core_invention,"Quantum technology is central to the independent claims (1, 18, 19), which require generating and storing entangled quantum particles in quantum storage cells. The invention relies on measuring these entangled particles to generate random numbers for authentication and key generation.",TLS,RSA; AES; Diffie-Hellman; ECDSA; ECDH; DSA,,entanglement; qrng,generation; storage; distribution,quantum-source; quantum-storage-cells; quantum-authentication-device,possession,,HNDL; MITM; quantum-attack; brute-force,quantum-entanglement,symmetric-cipher; KDF,banking; financial-services,system for quantum one-time pad generation; method for quantum one-time pad generation; computer program product for quantum one-time pad generation,,financial; session-keys; mortgages; tax-information,,,"[{""claim"": 1, ""depends_on"": [], ""subject"": ""system for quantum one-time pad generation""}, {""claim"": 2, ""depends_on"": [1], ""subject"": ""matrix of quantum storage cells""}, {""claim"": 3, ""depends_on"": [1], ""subject"": ""splitting output of quantum particle source""}, {""claim"": 4, ""depends_on"": [1], ""subject"": ""transmit first quantum one-time pad""}, {""claim"": 5, ""depends_on"": [1], ""subject"": ""store in quantum authentication device""}, {""claim"": 6, ""depends_on"": [1], ""subject"": ""store for access by computing device""}, {""claim"": 7, ""depends_on"": [1], ""subject"": ""generate key and encrypt communication""}, {""claim"": 8, ""depends_on"": [7], ""subject"": ""symmetric cryptographic key""}, {""claim"": 9, ""depends_on"": [7], ""subject"": ""quantum asymmetric cryptographic key""}, {""claim"": 10, ""depends_on"": [1], ""subject"": ""measure subset based on quantum bases""}, {""claim"": 11, ""depends_on"": [10], ""subject"": ""measurement initiation control signal""}, {""claim"": 12, ""depends_on"": [10], ""subject"": ""QC detection or tampering alert signal""}, {""claim"": 13, ""depends_on"": [1], ""subject"": ""session authentication via random number comparison""}, {""claim"": 14, ""depends_on"": [13], ""subject"": ""generate session key based on random number""}, {""claim"": 15, ""depends_on"": [14], ""subject"": ""set session key equal to random number""}, {""claim"": 16, ""depends_on"": [1], ""subject"": ""time-dependent measurement schedule""}, {""claim"": 17, ""depends_on"": [1], ""subject"": ""sequence-dependent measurement schedule""}, {""claim"": 18, ""depends_on"": [], ""subject"": ""method for quantum one-time pad generation""}, {""claim"": 19, ""depends_on"": [], ""subject"": ""computer program product for quantum one-time pad generation""}]",[]
11349644,Database exclusion (DBX) for multi party access (MPA) to sensitive personal information (SPI),Stapleton; Jeff J.,"Wells Fargo Bank, N.A.",2020-04-29,2022-05-31,G06F21/6245;H04L9/0825;H04L9/0822;G06F21/6218;H04L9/14;H04L9/0869,A system encrypts sensitive personal information with unique random symmetric keys per client and wraps those keys with client public keys to isolate data access in multi-party cloud environments.,"The invention generates a distinct encrypted copy of a data record for each requesting client using a unique random symmetric key. It then encrypts that specific symmetric key using the requesting client's public key, ensuring only that client can decrypt their specific copy while others cannot access it even if they share the database.",classical_only,none,none,none,TLS; SSH,,,none,generation; distribution; storage; destruction,mobile,possession,,insider,deterministic-PRNG,symmetric-cipher; KEM,banking; cloud,method for protecting SPI from MPA; system comprising processors and storage mediums; non-transitory computer-readable storage medium,,PII; financial,,,"[{""claim"": 1, ""depends_on"": [], ""subject"": ""method for protecting SPI from MPA""}, {""claim"": 2, ""depends_on"": [1], ""subject"": ""retrieving encrypted data record""}, {""claim"": 3, ""depends_on"": [1], ""subject"": ""decrypting encrypted symmetric key""}, {""claim"": 4, ""depends_on"": [3], ""subject"": ""decrypting encrypted data record""}, {""claim"": 5, ""depends_on"": [1], ""subject"": ""retrieving from internal database""}, {""claim"": 6, ""depends_on"": [1], ""subject"": ""triggering event and destruction""}, {""claim"": 7, ""depends_on"": [6], ""subject"": ""time window or retrieval trigger""}, {""claim"": 8, ""depends_on"": [6], ""subject"": ""client discarding key on time elapse""}, {""claim"": 9, ""depends_on"": [1], ""subject"": ""transmitting to second client device""}, {""claim"": 10, ""depends_on"": [1], ""subject"": ""co-existing encrypted records""}, {""claim"": 11, ""depends_on"": [1], ""subject"": ""encrypting for second client device""}, {""claim"": 12, ""depends_on"": [1], ""subject"": ""request includes public key""}, {""claim"": 13, ""depends_on"": [1], ""subject"": ""generating random symmetric key via PRNG""}, {""claim"": 14, ""depends_on"": [1], ""subject"": ""generating common secret and KEK""}, {""claim"": 15, ""depends_on"": [], ""subject"": ""system for protecting SPI from MPA""}, {""claim"": 16, ""depends_on"": [15], ""subject"": ""retrieving encrypted data record""}, {""claim"": 17, ""depends_on"": [15], ""subject"": ""decrypting encrypted symmetric key""}, {""claim"": 18, ""depends_on"": [17], ""subject"": ""decrypting encrypted data record""}, {""claim"": 19, ""depends_on"": [15], ""subject"": ""retrieving from internal database""}, {""claim"": 20, ""depends_on"": [15], ""subject"": ""triggering event and destruction""}, {""claim"": 21, ""depends_on"": [15], ""subject"": ""transmitting to second client device""}, {""claim"": 22, ""depends_on"": [15], ""subject"": ""encrypting for second client device""}, {""claim"": 23, ""depends_on"": [15], ""subject"": ""generating common secret and KEK""}, {""claim"": 24, ""depends_on"": [], ""subject"": ""non-transitory computer-readable storage medium""}, {""claim"": 25, ""depends_on"": [], ""subject"": ""method from client device perspective""}]",[]
11343270,Systems and methods for post-quantum cryptography optimization,"Carter, Jr.; Robert L. et al.","Wells Fargo Bank, N.A.",2019-09-10,2022-05-24,H04L9/088;G06N10/60;G06N5/01;H04L63/20;G06N10/80;H04L63/1433;H04L9/0852,A system generates risk profiles for data based on policy attributes to determine vulnerability in a post-quantum environment and selects appropriate cryptographic techniques for migration.,"The invention claims a system that retrieves policy information to generate policy attributes, which are used to create a risk profile data structure indicative of data vulnerability in a post-quantum cryptography environment. This risk profile subsequently drives the selection of specific post-quantum cryptographic techniques for encrypting the data.",negotiated,assessment,core_invention,"Quantum computing is central to the invention, appearing in independent claims 1, 19, and 20 as the basis for the 'PQC data environment' and the generation of risk profiles. The system specifically addresses vulnerabilities posed by quantum computers (e.g., Shor's algorithm) and selects PQC algorithms to mitigate these threats.",TLS; SWIFT; ISO 8583; ISO 20022,RSA; Diffie-Hellman; ECDH; ECDSA; DSA; AES,LMS; XMSS; SPHINCS+; Dilithium; qTESLA; NewHope; FrodoKEM; NTRU Prime; Kyber; SIKE; SIDH; Classic McEliece; QC-MDPC; BIKE; Rainbow; Picnic,quantum_computing,generation; exchange; distribution,,,NIST Post-Quantum Cryptography Standardization Process,HNDL; quantum-attack; cryptanalysis,,symmetric-cipher; KEM; signature; hash; ZK,banking; financial; healthcare; government; cloud,system for post-quantum cryptography (PQC); method for post-quantum cryptography (PQC); computer program product for post-quantum cryptography (PQC),,financial; PHI; PII; copyrighted content,FDIC Records Retention Schedule,,"[{""claim"": 1, ""depends_on"": [], ""subject"": ""system for PQC""}, {""claim"": 2, ""depends_on"": [1], ""subject"": ""temporal PQC threat policy attribute""}, {""claim"": 3, ""depends_on"": [2], ""subject"": ""technological advancements""}, {""claim"": 4, ""depends_on"": [1], ""subject"": ""value of data""}, {""claim"": 5, ""depends_on"": [1], ""subject"": ""longevity of data""}, {""claim"": 6, ""depends_on"": [1], ""subject"": ""cryptostrength of data""}, {""claim"": 7, ""depends_on"": [1], ""subject"": ""vulnerability scan circuitry""}, {""claim"": 8, ""depends_on"": [1], ""subject"": ""vulnerability score generation""}, {""claim"": 9, ""depends_on"": [8], ""subject"": ""vulnerability score range""}, {""claim"": 10, ""depends_on"": [8], ""subject"": ""vulnerability score explanation""}, {""claim"": 11, ""depends_on"": [8], ""subject"": ""compliance score generation""}, {""claim"": 12, ""depends_on"": [11], ""subject"": ""compliance score value""}, {""claim"": 13, ""depends_on"": [12], ""subject"": ""normalized scores""}, {""claim"": 14, ""depends_on"": [1], ""subject"": ""data envelope attributes""}, {""claim"": 15, ""depends_on"": [14], ""subject"": ""second enveloped data structure""}, {""claim"": 16, ""depends_on"": [1], ""subject"": ""PQC cryptographic circuitry""}, {""claim"": 17, ""depends_on"": [1], ""subject"": ""machine learning technique""}, {""claim"": 18, ""depends_on"": [1], ""subject"": ""risk profile GUI""}, {""claim"": 19, ""depends_on"": [], ""subject"": ""method for PQC""}, {""claim"": 20, ""depends_on"": [], ""subject"": ""computer program product for PQC""}]","[{""algorithm"": ""Kyber"", ""status"": ""fips_203""}, {""algorithm"": ""Dilithium"", ""status"": ""fips_204""}, {""algorithm"": ""SPHINCS+"", ""status"": ""fips_205""}, {""algorithm"": ""Classic McEliece"", ""status"": ""round4_candidate""}, {""algorithm"": ""BIKE"", ""status"": ""round4_candidate""}, {""algorithm"": ""FrodoKEM"", ""status"": ""withdrawn""}, {""algorithm"": ""SIKE"", ""status"": ""withdrawn""}, {""algorithm"": ""Rainbow"", ""status"": ""withdrawn""}, {""algorithm"": ""Picnic"", ""status"": ""round4_candidate""}, {""algorithm"": ""LMS"", ""status"": ""stateful_hash_standard""}, {""algorithm"": ""XMSS"", ""status"": ""stateful_hash_standard""}]"
11336462,Systems and methods for post-quantum cryptography optimization,Maganti; Ravi K. et al.,"Wells Fargo Bank, N.A.",2019-09-10,2022-05-17,H04L9/0852;H04L9/3247;H04L9/0656;H04L9/0841;H04L9/3263;H04L9/302;H04L9/3249;H04L9/0631;H04L9/0844,"A system generates fictitious data encrypted with classical keys, destroys the private key, and monitors environments for decrypted data to detect quantum computing threats.","The invention creates a honeypot by generating QC detection data, encrypting it with asymmetric keys (RSA/DH), and destroying the private key. It then monitors external environments for the appearance of this specific encrypted or decrypted data to signal that a quantum computer has broken the classical encryption.",hybrid,assessment,core_invention,"Quantum computing is the central subject of the invention, appearing in independent claims 1, 17, and 19 as 'QC detection'. The system is designed specifically to detect when a quantum computer has broken classical encryption (RSA/DH) by finding decrypted honeypot data. Claim 6 mentions PQC techniques as an optional double-encryption layer.",TLS; X.509,RSA; DH; AES; ECDSA; ECDH,LMS; XMSS; SPHINCS+; Dilithium; qTESLA; NewHope; FrodoKEM; NTRU Prime; Kyber; SIKE; SIDH; Classic McEliece; QC-MDPC; BIKE; Rainbow; Picnic,quantum_computing,generation; destruction; storage,,,NIST Post-Quantum Cryptography Standardization Process,HNDL; quantum-attack; cryptanalysis,,symmetric-cipher; signature; KEM,banking; financial,system for quantum computing detection; method for quantum computing detection; computer program product for quantum computing detection,,fictitious data; financial records; mortgage information,FDIC Records Retention Schedule,,"[{""claim"": 1, ""depends_on"": [], ""subject"": ""system for quantum computing detection""}, {""claim"": 2, ""depends_on"": [1], ""subject"": ""generating QC detection alert control signal""}, {""claim"": 3, ""depends_on"": [1], ""subject"": ""QC detection data as fictitious code-signing certificate""}, {""claim"": 4, ""depends_on"": [1], ""subject"": ""RSA asymmetric cryptographic keys""}, {""claim"": 5, ""depends_on"": [1], ""subject"": ""DH asymmetric cryptographic keys""}, {""claim"": 6, ""depends_on"": [1], ""subject"": ""double encryption with PQC technique""}, {""claim"": 7, ""depends_on"": [1], ""subject"": ""not transmitting encrypted data and generating leakage alert""}, {""claim"": 8, ""depends_on"": [1], ""subject"": ""electronic information as decrypted QC detection data""}, {""claim"": 9, ""depends_on"": [1], ""subject"": ""encrypted data comprising digitally signed QC detection data""}, {""claim"": 10, ""depends_on"": [1], ""subject"": ""detecting and verifying digital signature""}, {""claim"": 11, ""depends_on"": [10], ""subject"": ""generating tampering alert control signal""}, {""claim"": 12, ""depends_on"": [1], ""subject"": ""generating symmetric key encrypted by asymmetric keys""}, {""claim"": 13, ""depends_on"": [12], ""subject"": ""encrypting QC detection data with symmetric key""}, {""claim"": 14, ""depends_on"": [12], ""subject"": ""AES symmetric key and RSA asymmetric keys""}, {""claim"": 15, ""depends_on"": [1], ""subject"": ""generating symmetric key based on asymmetric keys""}, {""claim"": 16, ""depends_on"": [15], ""subject"": ""AES symmetric key and DH asymmetric keys""}, {""claim"": 17, ""depends_on"": [], ""subject"": ""method for quantum computing detection""}, {""claim"": 18, ""depends_on"": [17], ""subject"": ""generating QC detection alert control signal""}, {""claim"": 19, ""depends_on"": [], ""subject"": ""computer program product for quantum computing detection""}, {""claim"": 20, ""depends_on"": [19], ""subject"": ""generating QC detection alert control signal""}]","[{""algorithm"": ""Kyber"", ""status"": ""fips_203""}, {""algorithm"": ""Dilithium"", ""status"": ""fips_204""}, {""algorithm"": ""SPHINCS+"", ""status"": ""fips_205""}, {""algorithm"": ""Classic McEliece"", ""status"": ""round4_candidate""}, {""algorithm"": ""BIKE"", ""status"": ""round4_candidate""}, {""algorithm"": ""FrodoKEM"", ""status"": ""withdrawn""}, {""algorithm"": ""SIKE"", ""status"": ""withdrawn""}, {""algorithm"": ""Rainbow"", ""status"": ""withdrawn""}, {""algorithm"": ""LMS"", ""status"": ""stateful_hash_standard""}, {""algorithm"": ""XMSS"", ""status"": ""stateful_hash_standard""}, {""algorithm"": ""Picnic"", ""status"": ""round4_candidate""}, {""algorithm"": ""NewHope"", ""status"": ""classical""}, {""algorithm"": ""NTRU Prime"", ""status"": ""classical""}, {""algorithm"": ""qTESLA"", ""status"": ""classical""}]"
11308234,Methods for protecting data,Stapleton; Jeff J.,"Wells Fargo Bank, N.A.",2020-04-02,2022-04-19,G06F21/6245;G06F21/602;H04L9/008;G06F21/64;G06F21/6227,"A method protects sensitive production data by decrypting it, applying homomorphic encryption and masking in a secure middle environment, then storing the masked cleartext in a lower security environment for testing.","The invention utilizes a three-tier architecture where a secure middle environment acts as a proxy to transform production data. It decrypts encrypted production data, re-encrypts it using homomorphic encryption, applies a masking function, and decrypts the result to generate masked cleartext for lower environments.",classical_only,none,none,"The patent text does not mention quantum technology, quantum cryptography, or post-quantum algorithms. The invention relies on classical homomorphic encryption and symmetric/asymmetric ciphers.",SSL; HTTPS; IPSec; Kerberos,AES; 3DES; RSA; TDES,,none,storage; distribution,HSM; FPGA; ASIC,knowledge; possession,,insider; exposure,,symmetric-cipher; hash,banking; cloud,method of protecting data via homomorphic encryption and masking; system comprising processing circuits for data protection,,PII; financial,,,"[{""claim"": 1, ""depends_on"": [], ""subject"": ""method of protecting data""}, {""claim"": 2, ""depends_on"": [1], ""subject"": ""production environment inaccessibility""}, {""claim"": 3, ""depends_on"": [2], ""subject"": ""provider institution environments""}, {""claim"": 4, ""depends_on"": [1], ""subject"": ""encrypted data definition""}, {""claim"": 5, ""depends_on"": [4], ""subject"": ""inaccessibility of cleartext and keys""}, {""claim"": 6, ""depends_on"": [4], ""subject"": ""data structure level encryption""}, {""claim"": 7, ""depends_on"": [1], ""subject"": ""production environment code execution""}, {""claim"": 8, ""depends_on"": [7], ""subject"": ""storage of encrypted cleartext""}, {""claim"": 9, ""depends_on"": [1], ""subject"": ""homomorphic encryption operators""}, {""claim"": 10, ""depends_on"": [], ""subject"": ""method maintaining ciphertext data""}, {""claim"": 11, ""depends_on"": [10], ""subject"": ""production environment inaccessibility""}, {""claim"": 12, ""depends_on"": [11], ""subject"": ""provider institution environments""}, {""claim"": 13, ""depends_on"": [10], ""subject"": ""ciphertext data definition""}, {""claim"": 14, ""depends_on"": [13], ""subject"": ""inaccessibility of cleartext and keys""}, {""claim"": 15, ""depends_on"": [13], ""subject"": ""data structure level encryption""}, {""claim"": 16, ""depends_on"": [10], ""subject"": ""production environment code execution""}, {""claim"": 17, ""depends_on"": [16], ""subject"": ""storage of encrypted cleartext""}, {""claim"": 18, ""depends_on"": [10], ""subject"": ""homomorphic encryption operators""}, {""claim"": 19, ""depends_on"": [], ""subject"": ""system for protecting data""}, {""claim"": 20, ""depends_on"": [19], ""subject"": ""encrypted data definition and inaccessibility""}]",[]
